answer,question_id,motivation_src,motivation,motivation_src_link,country_code,country_name,party_id,party_name_full,party_name_short,party_image,question,question_shared_id
75.0,765,"Interview, Pressemeldung und Social Media Kommunikation","""Gesetzliche und technische Optimierung von Datenermittlung/Weitergabe für die sicherheitspolizeiliche behördenübergreifende Verwendung im Einklang mit der Datenschutzgrundverordnung"""" (Regierungsprogramm 2017 - 2022). """"Die Polizei erhalte mit diesem Paket das notwendige Rüstzeug, um bei der Bekämpfung der schwersten Kriminalität auf der Höhe der Zeit zu sein, betonte Herbert Kickl. Überwacht werde nicht die Masse, die Maßnahmen richten sich vielmehr gegen jene, die die Sicherheit der Massen gefährden."""" (Parlamentskorrespondenz 433). """"Herbert Kickl vergeudet keine Zeit. Der Innenminister (FPÖ) schickte eine Novelle in Begutachtung, mit der die Datenschutz-Grundverordnung (DSGV) überarbeitet wird. Neben technischen Änderungen bringt der Entwurf eine Einschränkung von Bürgerrechten."""" (Der Standard 2018).""",https://www.fpoe.at/fileadmin/user_upload/www.fpoe.at/dokumente/2017/Zusammen_Fuer_Oesterreich_Regierungsprogramm.pdf (Zugegriffen: 12.03.2019). https://www.parlament.gv.at/PAKT/PR/JAHR_2018/PK0443/index.shtml   https://derstandard.at/2000072178743/Wegen-oeffentlicher-Ordnung-Kickl-beschraenkt-Datenschutz ,AT,Austria,482,Austrian Freedom Party,FPÖ,http://files2.societly.com.s3-website.eu-central-1.amazonaws.com/0000/0000/0010/candidates/0000/0000/0482/fp%C3%96-1554976218.png,Restrictions of personal privacy on the Internet should be accepted for public security reasons,14
50.0,766,SPÖ Grundsatzprogramm 2018,"""Für uns ist Bildungs- und Sozialpolitik die beste Präventions- und Sicherheitspolitik, das Strafrecht kann nur eine Form zur Kriminalitätsbekämpfung sein. Bei voller Berücksichtigung der Sicherheitsinteressen der Menschen unterstützen wir Alternativen zum herkömmlichen Strafvollzug.""",https://www.spoe.at/wp-content/uploads/sites/739/2018/12/Parteiprogramm2018.pdf,AT,Austria,332,Social Democratic Party of Austria,SPÖ,http://files2.societly.com.s3-website.eu-central-1.amazonaws.com/0000/0000/0010/candidates/0000/0000/0332/spoe_logo-150x150-1554880634.png,Criminals should be punished more severely,15
25.0,766,sic Johannes Voggenhuber,Eine derartige pauschale Aussage ist sachlich ungerechtfertigt. Die Angemessenheit der Strafen sind von Delikt zu Delikt zu beurteilen. Nach der Verschärfung der Strafen für sexuelle Belästigung und sexuell motivierter Gewalt sieht die Initiative „1EUROPA“ keine Veranlassung zu einer allgemeinen Verschärfung der Strafhöhen.,,AT,Austria,339,Initiative 1 Europe,Initiative 1 Europe,http://files2.societly.com.s3-website.eu-central-1.amazonaws.com/0000/0000/0010/candidates/0000/0000/0339/initiative_ein_europa_logo-1554880598.png,Criminals should be punished more severely,15
25.0,766,Pressemitteilung der Grünen Österreich,"""Die Bestrafung Krimineller ist Aufgabe der unabhängigen Gerichte in den Mitgliedsstaaten der EU. Die Politik muss dafür Sorge tragen, dass eine angemessene Bestrafung möglich ist. Dazu braucht es in erster Linie fähige Strafverfolgungsbehörden, die in der Lage sind, auch komplexe Straftaten aufzuklären. Die Strafe selbst, soll den Unrechtsgehalt einer Tat widerspiegeln. Besonders verwerfliche Delikte brauchen höhere Strafrahmen als andere. Der Schwerpunkt des Strafrechts muss aber im Bereich der Resozialisierung liegen. Nur so wird man mögliche WiederholungstäterInnen von der Begehung weiterer Straftaten wirksam abhalten können. Höhe Strafen alleine helfen da wenig bis gar nichts. Unabhängig von der Strafe muss zusätzlich gewährleistet sein, dass jenes Vermögen, das durch kriminelle Handlungen erwirtschaftet wurde, dem/der Verurteilten wieder vollständig entzogen wird.""",https://www.ots.at/presseaussendung/OTS_20150423_OTS0301/straf-und-massnahmenvollzug-sollen-reformiert-werden,AT,Austria,344,The Greens - The Green Alternative,GRÜNE,http://files2.societly.com.s3-website.eu-central-1.amazonaws.com/0000/0000/0010/candidates/0000/0000/0344/gruene_logo-1554880615.png,Criminals should be punished more severely,15
25.0,766,Interview/ Pressebericht auf ORF.at/ Twitter,"""Strengere Strafen alleine sind zu wenig [...] was es braucht, ist ein ganzheitlicherer Ansatz, der auch dem erhöhten Personalbedarf im Justizbereich Rechnung trägt.Zweck unseres Strafrechts ist es, sozialschädliches Verhalten zu verhindern, um die Freiheit des Einzelnen zu schützen. Dazu gehört auch, dass im Sinne der Opfer und der Sicherheit in der Gesellschaft Straftäter nicht einfach nur ihre Zeit in Haft absitzen, sondern auch auf das Leben nach der Strafe vorbereitet, also resozialisiert werden.""",https://orf.at/stories/3110979/  https://twitter.com/IrmgardGriss/status/1098234458224893952  https://twitter.com/IrmgardGriss/status/1097454159614361600  https://www.facebook.com/irmgardgriss/posts/2048993892066042,AT,Austria,472,The New Austria and Liberal Forum,NEOS,http://files2.societly.com.s3-website.eu-central-1.amazonaws.com/0000/0000/0010/candidates/0000/0000/0472/bild1-1554975321.png,Criminals should be punished more severely,15
75.0,766,Wahlprogramm zur Nationalratswahl 2017,"""Wir müssen aber nicht nur die Polizei stärken, wir müssen bei verschiedenen Vergehen auch härtere Strafen einführen, um ein klares Signal an Verbrecherinnen und Verbrecher zu senden. """,https://res.dieneuevolkspartei.at/Files/SK_Wahlprogramm_Teil3.pdf-gOMfoI.pdf,AT,Austria,475,Austrian People's Party,ÖVP,http://files2.societly.com.s3-website.eu-central-1.amazonaws.com/0000/0000/0010/candidates/0000/0000/0475/%C3%B6vp-1554926338.jpeg,Criminals should be punished more severely,15
100.0,766,Parteiprogramm 2011,"""Bei der Bekämpfung des organisierten Verbrechens, des Banden- und Schlepperunwesens, des Drogenhandels, des Terrorismus, der Gewalt und anderer Kriminalitätserscheinungen hat der Staat seine Möglichkeiten entschlossen zu nutzen."""" (…) """"Im Strafvollzug haben der Schutz unserer Gesellschaft sowie Schutz und Hilfe für Verbrechensopfer höchsten Stellenwert"""" (Parteiprogramm 2011). """"Das hat Innenminister Herbert Kickl richtigerweise erkannt und daher hat er viele notwendige Maßnahmen bereits umgesetzt. Es ist auch weiterhin unser erklärtes Ziel, die Sicherheit der Bevölkerung zu erhöhen und es wird daher notwendig sein, auf Änderungen der Rahmenbedingungen zu reagieren. Der Gesetzgeber kann und darf bei Asylmissbrauch, Gewalt gegenüber Frauen, wachsender Kriminalität, Fällen von Sozialmissbrauch und sexuellen Übergriffen nicht tatenlos zusehen, sondern muss handeln. Das sind wir den Menschen in Österreich schuldig"""" (Pressemitteilung).""",https://www.fpoe.at/fileadmin/user_upload/www.fpoe.at/dokumente/2015/2011_graz_parteiprogramm_web.pdf ,AT,Austria,482,Austrian Freedom Party,FPÖ,http://files2.societly.com.s3-website.eu-central-1.amazonaws.com/0000/0000/0010/candidates/0000/0000/0482/fp%C3%96-1554976218.png,Criminals should be punished more severely,15
50.0,767,SPÖ Grundsatzprogramm 2018,"""Die Europäische Union trägt Verantwortung für die Welt. Gerade vor dem Hintergrund der blutigen Geschichte unseres Kontinents hat die EU die moralische Verpflichtung, sich für Frieden und Sicherheit in der Welt einzusetzen. Dafür bildet die sich stets weiterentwickelnde Gemeinsame Außen-, Sicherheits- und Verteidigungspolitik, die die Neutralität einiger Mitgliedstaaten wie Österreich berücksichtigt, den geeigneten Rahmen.""",https://www.spoe.at/wp-content/uploads/sites/739/2018/12/Parteiprogramm2018.pdf,AT,Austria,332,Social Democratic Party of Austria,SPÖ,http://files2.societly.com.s3-website.eu-central-1.amazonaws.com/0000/0000/0010/candidates/0000/0000/0332/spoe_logo-150x150-1554880634.png,The European Union should strengthen its security and defence policy,16
75.0,767,"""Elefantenrunde"" mit den Spitzenkandidat/innen zur Europawahl 2019, ORF, 20.03.2019.","""Wenn wir eine Europäische Einheit wollen, dann muss es auch eine gemeinsame Verantwortung für die gemeinsame Sicherheit geben. Die Voraussetzungen werden übersprungen wenn man eine gemeinsame Armee fordert. Das erste wäre einmal eine autonome, souveräne, demokratische Außenpolitik.""",https://tvthek.orf.at/profile/Klartext/13689154/Klartext-Konfrontation-der-Spitzenkandidaten/14008041,AT,Austria,339,Initiative 1 Europe,Initiative 1 Europe,http://files2.societly.com.s3-website.eu-central-1.amazonaws.com/0000/0000/0010/candidates/0000/0000/0339/initiative_ein_europa_logo-1554880598.png,The European Union should strengthen its security and defence policy,16
75.0,767,EU-Wahlprogramm der Europapartei,"""Die Grünen treten für die Vergemeinschaftung der Außenpolitik und in deren Folge für die Vergemeinschaftung der Sicherheitspolitik ein. Nach mehr als ein halbes Jahrhundert nach dem Ende des Zweiten Weltkrieges soll Europa die Verantwortung für seine Sicherheit selbst übernehmen.  Europa braucht gemeinsame Strukturen, um gemeinsame Aufgaben der internationalen Friedenspolitik zu bewältigen.  Gut eingebettet in eine vorsorgende Außenpolitik, fest verankert in den internationalen Einrichtungen und im Völkerrecht, kontrolliert und bestimmt von einem starken europäischen Parlament, eigenverantwortlich in Europa und solidarisch in der Welt – das ist der Kern einer europäischen Friedenspolitik, für den sich die Grünen einsetzen. Wir Grüne möchten verstärkt in zivile Konfliktprävention, Vermittlung, Versöhnung und friedenserhaltende Maßnahmen investieren und treten gegen eine Aufstockung von EU Fonds für militärische Zwecke ein. Nachhaltige Sicherheit und Stabilität können nicht mit Waffen kreiert werden. Das Konzept der ""Human Security"" steht für die Grünen im Vordergrund.""",https://vote.europeangreens.eu/manifesto,AT,Austria,344,The Greens - The Green Alternative,GRÜNE,http://files2.societly.com.s3-website.eu-central-1.amazonaws.com/0000/0000/0010/candidates/0000/0000/0344/gruene_logo-1554880615.png,The European Union should strengthen its security and defence policy,16
100.0,767,Wahlprogramm zur Europawahl 2019,"""Im Sinne der Subsidiarität lässt sich das Thema Sicherheit und Verteidigung klar als einer jener Bereiche identifizieren, bei denen die Union effektiver und effizienter sein kann als die einzelnen EU-Mitgliedstaaten. [...] Je stärker das politische Vertrauen, desto enger die militärischen Kooperationschancen zwischen den Mitgliedstaaten. Alle innereuropäisch bestehenden Harmonisierungs- und Integrationsmöglichkeiten im Sicherheitsund Verteidigungsbereich sind voll auszunutzen. Dringend ist unter anderem eine gemeinsame und gemeinsam finanzierte Sicherung des europäischen Luftraums, die etwa die Anschaffung von eigenen österreichischen Abfangjägern überflüssig machen würde. Es braucht Schritte in Richtung einer europäischen Integration der Kommandostrukturen bei EUMissionen. Langfristig ist eine Europäische Armee unter gemeinsamem Oberbefehl und parlamentarischer Kontrolle das Ziel, um die europäische Souveränität zu jedem Zeitpunkt sichern und verteidigen zu können. Zu allererst ist die Ständige Strukturierte Zusammenarbeit (PESCO) im Bereich Verteidigung über eine Liste mit nationalstaatlich vorangetriebenen Projekten hinaus auszuweiten. In den nächsten Jahren sollen echte europäische Projekte dazu kommen, die einen europäischen Mehrwert generieren und nicht nur die Präferenzen nationalstaatlicher Rüstungskonzerne widerspiegeln.""",https://europa.neos.eu/_Resources/Persistent/e4e6d86c469f335a77d3435dbee6d4e8fa95fc42/NEOS%20EU-Programm%202019.pdf,AT,Austria,472,The New Austria and Liberal Forum,NEOS,http://files2.societly.com.s3-website.eu-central-1.amazonaws.com/0000/0000/0010/candidates/0000/0000/0472/bild1-1554975321.png,The European Union should strengthen its security and defence policy,16
100.0,767,Wahlprogramm zur Nationalratswahl 2017,"""Vor allem im Bereich der Außen-,Sicherheits- und Verteidigungspolitik soll es aber zu einer Stärkung der Europäischen Union kommen. Wir brauchen eine zivil-militärische Grenzschutztruppe für EU-Assistenzeinsätze an den Außengrenzen der EU unter ziviler Führung und eine robuste Kriseneingriffstruppe auf europäischer Ebene, die in akuten Krisenfällen zum Schutz Europas international zum Einsatz kommt.""",https://res.dieneuevolkspartei.at/Files/SK_Wahlprogramm_Teil3.pdf-gOMfoI.pdf,AT,Austria,475,Austrian People's Party,ÖVP,http://files2.societly.com.s3-website.eu-central-1.amazonaws.com/0000/0000/0010/candidates/0000/0000/0475/%C3%B6vp-1554926338.jpeg,The European Union should strengthen its security and defence policy,16
75.0,767,Parteiprogramm 2011 ,"""Wir bekennen uns zu einer gemeinsamen Außen- und Sicherheitspolitik eines solchen europäischen Staatenverbunds unter Wahrung der österreichischen Neutralität und in klarer Abgrenzung von außereuropäischen Mächten und außereuropäisch dominierten Militärbündnissen zur weltweiten Wahrung gemeinsamer europäischer Interessen.""",Parteiprogramm 2011 (Party election platform): https://www.fpoe.at/fileadmin/user_upload/www.fpoe.at/dokumente/2015/2011_graz_parteiprogramm_web.pdf (Zugegriffen: 12.03.2019).,AT,Austria,482,Austrian Freedom Party,FPÖ,http://files2.societly.com.s3-website.eu-central-1.amazonaws.com/0000/0000/0010/candidates/0000/0000/0482/fp%C3%96-1554976218.png,The European Union should strengthen its security and defence policy,16
75.0,768,"Leitantrag 3 des 44. ordentlichen Bundesparteitages, 24. und 25. November 2018","""Gerade in Zeiten, wo weltpolitische AkteurInnen vermehrt die Kooperation mit der Staatengemeinschaft in Frage stellen und ihren völkerrechtlichen Verpflichtungen nicht nachkommen, braucht es eine starke EU, die sich für die genannten Werte und Ziele einsetzt.""",https://www.spoe.at/wp-content/uploads/sites/739/2018/11/EUWahl_Leitantrag_3.pdf,AT,Austria,332,Social Democratic Party of Austria,SPÖ,http://files2.societly.com.s3-website.eu-central-1.amazonaws.com/0000/0000/0010/candidates/0000/0000/0332/spoe_logo-150x150-1554880634.png,On foreign policy issues the European Union should speak with one voice,17
100.0,768,Manifest zur Wahl des Europäischen Parlaments 2019,"""[Die Initiative 1 Europa] tritt für eine gemeinsame, souveräne und autonome Außen-und Sicherheitspolitik ein, die auf einer Europäischen Friedensordnung beruht und sich den Werten und Zielen der Vereinten Nationen verpflichtet. Keine militärische Aktion darf von der Union oder einem seiner Mitgliedsstaaten ausgehen ohne Zustimmung des Europäischen Parlaments.""",https://www.1europa.at/manifest,AT,Austria,339,Initiative 1 Europe,Initiative 1 Europe,http://files2.societly.com.s3-website.eu-central-1.amazonaws.com/0000/0000/0010/candidates/0000/0000/0339/initiative_ein_europa_logo-1554880598.png,On foreign policy issues the European Union should speak with one voice,17
100.0,768,Pressemitteilung der Grünen Österreich,"""Eine echte gemeinsame Außenpolitik, unabhängig der USA oder Russland, ist längst überfällig.  Die Kriegsschauplätze und Krisen im Nahen Osten, in Afrika und in der Ukraine mahnen uns jeden Tag, in diese Richtung zu gehen. Das bedeutet ein Schritt in Richtung europäischer Friedenspolitik, die über die europöishen Grenzen hinauswirkt. Die wichtigste Voraussetzung für jegliche europäische Sicherheitspolitik stelle die Konsolidierung der Außenpolitik Europas dar.""",https://www.gruene.at/ots/kogler-ohne-gemeinsame-aussenpolitik-keine-gemeinsame-armee,AT,Austria,344,The Greens - The Green Alternative,GRÜNE,http://files2.societly.com.s3-website.eu-central-1.amazonaws.com/0000/0000/0010/candidates/0000/0000/0344/gruene_logo-1554880615.png,On foreign policy issues the European Union should speak with one voice,17
100.0,768,Wahlprogramm zur Europawahl 2019,"""Die Außenpolitik der Europäischen Union und damit der/die Hohe Vertreter_in verdient echten Entscheidungsspielraum und die Unterstützung aller Mitgliedstaaten. Er/Sie soll ein/e echte/r Außenminister_in für die EU werden. Die Union soll ihre 2016 entschiedene klare wertebasierte Europäische Globalstrategie bedienen, anstatt 28 (bald 27) nationalstaatliche Partikularinteressen. Dazu muss auch das Einstimmigkeitsprinzip im Bereich der Durchführung der Gemeinsamen Außen- und Sicherheitspolitik (GASP) und der Gemeinsamen Sicherheits- und Verteidigungspolitik (GSVP) abgeschafft werden. Stattdessen soll per qualifizierter Mehrheit entschieden werden (55 Prozent der Mitgliedstaaten und 65 Prozent der Einwohner_innen). Als Zwischenschritt wäre es denkbar, die Anwendung des Einstimmigkeitsprinzips im Bereich der GASP/GSVP zumindest einzuschränken.""",https://europa.neos.eu/_Resources/Persistent/e4e6d86c469f335a77d3435dbee6d4e8fa95fc42/NEOS%20EU-Programm%202019.pdf,AT,Austria,472,The New Austria and Liberal Forum,NEOS,http://files2.societly.com.s3-website.eu-central-1.amazonaws.com/0000/0000/0010/candidates/0000/0000/0472/bild1-1554975321.png,On foreign policy issues the European Union should speak with one voice,17
100.0,768,Wahlprogramm zur Nationalratswahl 2017,"""Die EVP ist überzeugt, dass eine klare Mehrheit der Menschen in ganz Europa auch eine starke Europäische Union will, die Probleme effektiv auf europäischer Ebene angeht: die Probleme, und nur diejenigen, die von den Mitgliedstaaten nur unzureichend allein gelöst werden können. Unsere politischen Methoden, die auf Subsidiarität und Solidarität beruhen, sollten die Leitprinzipien unserer Gesellschaften sein. Eine klarere Aufteilung der Zuständigkeiten zwischen den europäischen, nationalen und subnationalen Ebenen, Solidarität und Personalismus, sowie die Stärkung der europäischen Einheit und mit einer Stimme zu sprechen, wird von entscheidender Bedeutung sein. Nur dann werden wir in der Lage sein, die besten Antworten auf globale, europäische, nationale, regionale und lokale Herausforderungen geben zu können. """,https://res.dieneuevolkspartei.at/Files/SK_Wahlprogramm_Teil3.pdf-gOMfoI.pdf,AT,Austria,475,Austrian People's Party,ÖVP,http://files2.societly.com.s3-website.eu-central-1.amazonaws.com/0000/0000/0010/candidates/0000/0000/0475/%C3%B6vp-1554926338.jpeg,On foreign policy issues the European Union should speak with one voice,17
50.0,768,Parteiprogramm 2011 ,"""Wir bekennen uns zu einer gemeinsamen Außen- und Sicherheitspolitik eines solchen europäischen Staatenverbunds unter Wahrung der österreichischen Neutralität und in klarer Abgrenzung von außereuropäischen Mächten und außereuropäisch dominierten Militärbündnissen zur weltweiten Wahrung gemeinsamer europäischer Interessen.""",https://www.fpoe.at/fileadmin/user_upload/www.fpoe.at/dokumente/2015/2011_graz_parteiprogramm_web.pdf ,AT,Austria,482,Austrian Freedom Party,FPÖ,http://files2.societly.com.s3-website.eu-central-1.amazonaws.com/0000/0000/0010/candidates/0000/0000/0482/fp%C3%96-1554976218.png,On foreign policy issues the European Union should speak with one voice,17
100.0,769,"Leitantrag 3 des 44. ordentlichen Bundesparteitages, 24. und 25. November 2018","""Die Europäische Union ist eine der größten zivilisatorischen Errungenschaften der Menschheitsgeschichte. Sie war die Antwort auf verheerende Kriege und hat unserem Kontinent Freiheit, Sicherheit, Stabilität, Wohlstand und viele Vorteile gebracht, die ohne sie undenkbar gewesen wären. Mit der Gründung der Europäischen Union war ein Versprechen verbunden: Uns allen sollte es mit und durch die Europäische Union besser gehen.""",https://www.spoe.at/wp-content/uploads/sites/739/2018/11/EUWahl_Leitantrag_3.pdf,AT,Austria,332,Social Democratic Party of Austria,SPÖ,http://files2.societly.com.s3-website.eu-central-1.amazonaws.com/0000/0000/0010/candidates/0000/0000/0332/spoe_logo-150x150-1554880634.png,European integration is a good thing,18
100.0,769,"""Die Initiative „Ein Europa“ will dazu beitragen, die Einigung Europas voran zu treiben.""","""[Die Initiative 1 Europa] tritt für eine gemeinsame, souveräne und autonome Außen-und Sicherheitspolitik ein, die auf einer Europäischen Friedensordnung beruht und sich den Werten und Zielen der Vereinten Nationen verpflichtet. Keine militärische Aktion darf von der Union oder einem seiner Mitgliedsstaaten ausgehen ohne Zustimmung des Europäischen Parlaments.""",https://www.1europa.at/manifest,AT,Austria,339,Initiative 1 Europe,Initiative 1 Europe,http://files2.societly.com.s3-website.eu-central-1.amazonaws.com/0000/0000/0010/candidates/0000/0000/0339/initiative_ein_europa_logo-1554880598.png,European integration is a good thing,18
100.0,769,Wahlprogramm zur Europawahl 2014,"""Das europäische Einigungsprojekt stellt einen historischen Erfolg der Überwindung von Nationalismus und Krieg dar. So konnte Frankreich und Deutschland ausgesöhnt und der Ost-Westkonflikt in Europa überwunden werden. Europa wird aber nicht ganz geeint sein, bevor nicht auch die Staaten des Westbalkans Teil der Union sind. Ausschlaggebend dafür ist die Erfüllung der demokratischen und rechtsstaatlichen Bedingungen im jeweiligen Kandidatenland.""",https://www.gruene.at/partei/programm/wahlprogramme/wahlprogramm-lang-ep-wahl-2014.pdf ,AT,Austria,344,The Greens - The Green Alternative,GRÜNE,http://files2.societly.com.s3-website.eu-central-1.amazonaws.com/0000/0000/0010/candidates/0000/0000/0344/gruene_logo-1554880615.png,European integration is a good thing,18
100.0,769,Wahlprogramm zur Europawahl 2019,"""Die Vision der NEOS für die EU ist Folgende:  Gemeinsam mit den Bürger_innen durchläuft Europa einen Reformprozess, der die Vertiefung und Erweiterung der EU vorantreibt. Die Bürger_innen bringen sich aktiv in den europäischen Diskurs ein und gestalten ein handlungsfähiges Europa. Ein Europäischer Konvent führt gemeinsam mit europäischen Volksabstimmungen dazu, dass bestehende Blockaden durchbrochen und Fragen der weiteren Integration vorbereitet werden. Die europäischen Institutionen haben sich zu einer leistungsfähigen Führung der europäischen Gemeinschaft entwickelt, die über eine Politik des nationalen Minimalkonsenses hinausgeht. Sie agieren effizient und transparent. Unser Europa ist ein Europa der Entbürokratisierung. Es steht für eine Regelung anstelle von 28 (bald 27) verschiedenen. Die an der Gesetzgebung beteiligten Institutionen befinden sich alle in Brüssel und bilden den Grundstein für eine Weiterentwicklung Brüssels zu einer echten europäischen Hauptstadt. Das Europäische Parlament besteht zu immer größeren Teilen aus gesamteuropäisch gewählten Abgeordneten, die über Gesetzesvorschläge für Europa entlang grundsätzlicher politischer Positionen und nicht auf Basis nationalstaatlicher Zugehörigkeit diskutieren. Der Rat ist zu einer zweiten Kammer des Parlaments weiterentwickelt, in der die nationalstaatlichen Interessen vertreten werden. Die Kommission ist eine starke europäische Regierung mit einem/einer direkt gewählten Regierungschef_in, der/die sich sein/ihr Team auf der Basis von Qualifikation und Mehrheiten im Parlament zusammenstellt. Unsere Vision der Vereinigten  Staaten von Europa wird mit jedem Integrationsschritt greifbarer. Die Bürger_innen Europas verstehen sich als europäische Bürger_innen. Die EU-Staaten respektieren, schützen und verteidigen die EU-Grundwerte. Wenn es doch zu einer Verletzung dieser kommt, hat die Union effektive Sanktionen zur Verfügung, um gegenüber dem betreffenden Staat die Einhaltung der Grundwerte und der Rechtsstaatlichkeit durchsetzen zu können. NEOS setzt sich im Rahmen der Fraktion der Allianz der Liberalen und Demokraten für Europe (ALDE) im Europäischen Parlament dafür ein, dass diese Visionen auch Wirklichkeit werden können.""",https://europa.neos.eu/_Resources/Persistent/e4e6d86c469f335a77d3435dbee6d4e8fa95fc42/NEOS%20EU-Programm%202019.pdf,AT,Austria,472,The New Austria and Liberal Forum,NEOS,http://files2.societly.com.s3-website.eu-central-1.amazonaws.com/0000/0000/0010/candidates/0000/0000/0472/bild1-1554975321.png,European integration is a good thing,18
100.0,769,Regierungsprogramm 2017,"""Europa steht für Freiheit, Demokratie und Chancen. Die Europäische Union ist nicht nur eine Wirtschaftsgemeinschaft, sondern auch eine Wertegemeinschaft. Gleichzeitig ist es wichtig, im Sinne der Subsidiarität darauf hinzuwirken, dass die EU sich auf die wesentlichen, für gemeinsame Lösungen geeigneten Themen fokussiert. Wir wollen daher eine Europäische Union, die die großen Themen anpackt, um die Bürger ihrer Mitgliedstaaten zu beschützen. Ein in diesem Sinne starkes Europa kann Stabilität garantieren, Wachstum fördern und Frieden sichern. [...] Subsidiarität bedeutet Vorrang für Eigenverantwortung und die kleinere Einheit. Sie fördert lebensnahe Lösungen und entlastet übergeordnete Gemeinschaften sowie den Staat. Subsidiarität ist ein Schlüsselwert im gemeinsamen Europa. Sie ist auch Garant gegen zentralistische Tendenzen in der Europäischen Union.""",https://www.dieneuevolkspartei.at/download/Regierungsprogramm.pdf,AT,Austria,475,Austrian People's Party,ÖVP,http://files2.societly.com.s3-website.eu-central-1.amazonaws.com/0000/0000/0010/candidates/0000/0000/0475/%C3%B6vp-1554926338.jpeg,European integration is a good thing,18
