answer,question_id,motivation_src,motivation,motivation_src_link,country_code,country_name,party_id,party_name_full,party_name_short,party_image,question,question_shared_id
100.0,760,Konzept zur Steuerreform 2017,"""In Österreich ist es notwendig, die hohe Steuer- und Abgabenquote zu senken und zusätzlich ausgabenseitig durch Reformen zu sparen. Es braucht strukturelle und nachhaltige Reformen, die die öffentlichen Konsumausgaben und Gehälter beinhalten, sowie Sozialausgaben und Transfers. Kompetitive Steuerquoten erhöhen die Wettbewerbsfähigkeit und machen den Standort attraktiver.",https://ichtuwas.neos.eu/hubfs/common/Positionen/Steuerreform_RZ.pdf,AT,Austria,472,The New Austria and Liberal Forum,NEOS,http://files2.societly.com.s3-website.eu-central-1.amazonaws.com/0000/0000/0010/candidates/0000/0000/0472/bild1-1554975321.png,Government spending should be reduced in order to lower taxes,9
100.0,760,Grundsatzprogramm 2015,"""Wenn wir die Steuer- und Abgabenquote senken und keine neuen Schulden machen wollen, heißt das natürlich auch, dass wir auf der Ausgabenseite Maßnahmen setzen müssen. Wenn wir die Wirtschaft ankurbeln, kann ein Teil der Entlastung über stärkeres Wachstum kommen. Wir müssen aber sicherstellen, dass der Staat nicht ebenso kräftig mitwächst, sondern bescheidener wird, und müssen daher das Ausgabenwachstum aller Staatsausgaben im Durchschnitt auf die Inflation reduzieren und Effizienzpotenziale im System nutzen.""",https://www.dieneuevolkspartei.at/Download/Grundsatzprogramm.pdf,AT,Austria,475,Austrian People's Party,ÖVP,http://files2.societly.com.s3-website.eu-central-1.amazonaws.com/0000/0000/0010/candidates/0000/0000/0475/%C3%B6vp-1554926338.jpeg,Government spending should be reduced in order to lower taxes,9
75.0,760,Parteiprogramm 2011,"""Niedrige Steuern und Leistungsanreize sind Voraussetzung für ein erfolgreiches Wirtschaften und einen gesunden Arbeitsmarkt. Sie sind Subventionen und Umverteilung vorzuziehen.""",https://www.fpoe.at/fileadmin/user_upload/www.fpoe.at/dokumente/2015/2011_graz_parteiprogramm_web.pdf ,AT,Austria,482,Austrian Freedom Party,FPÖ,http://files2.societly.com.s3-website.eu-central-1.amazonaws.com/0000/0000/0010/candidates/0000/0000/0482/fp%C3%96-1554976218.png,Government spending should be reduced in order to lower taxes,9
75.0,761,SPÖ Grundsatzprogramm 2018,"""Für eine gemeinsame Steuerpolitik! Wir wollen eine Steuerpolitik innerhalb der EU, die dem gemeinsamen Wirtschaftsraum gerecht wird. Wir brauchen ein Europa, in dem der Steuerhinterziehung großer Konzerne überall Einhalt geboten wird und es keinen Steuerwettbewerb nach unten gibt, sondern eine gemeinsame Steuerpolitik mit harmonisierten Unternehmenssteuersystemen mit Mindestsätzen.""",https://www.spoe.at/wp-content/uploads/sites/739/2018/12/Parteiprogramm2018.pdf,AT,Austria,332,Social Democratic Party of Austria,SPÖ,http://files2.societly.com.s3-website.eu-central-1.amazonaws.com/0000/0000/0010/candidates/0000/0000/0332/spoe_logo-150x150-1554880634.png,The EU should acquire its own tax raising powers,10
75.0,761,sic Johannes Voggenhuber,"Die Initiative „1EUROPA“ tritt für eigen klar deklarierte EU-Steuern ein, nicht jedoch für eine autonome Steuerhoheit der EU (kein Recht zur Erfindung von Steuern).",,AT,Austria,339,Initiative 1 Europe,Initiative 1 Europe,http://files2.societly.com.s3-website.eu-central-1.amazonaws.com/0000/0000/0010/candidates/0000/0000/0339/initiative_ein_europa_logo-1554880598.png,The EU should acquire its own tax raising powers,10
100.0,761,Pressemitteilung der Europapartei,"""Künftig solle sich die Union nicht mehr zum Großteil über Zuwendungen der Mitgliedsstaaten finanzieren, sondern nur noch über Eigenmittel ausfinanziert werden. Dies soll langfristige Möglichen bieten, das EU-Budget zu reformieren, zu sanieren und einzelne Ausfälle von Mitgliedsländern zu kompensieren“. Möglich wären unserer Meinung nach: CO2 Steuern, Plastiksteuern, Kerosinsteuern, Energiesteuer,Digitalsteuer oder auch eine gemeinsame Unternehmensteuerbasis.""",http://extranet.greens-efa-service.eu/public/media/file/1/5621,AT,Austria,344,The Greens - The Green Alternative,GRÜNE,http://files2.societly.com.s3-website.eu-central-1.amazonaws.com/0000/0000/0010/candidates/0000/0000/0344/gruene_logo-1554880615.png,The EU should acquire its own tax raising powers,10
100.0,761,Wahlprogramm zur Europawahl 2019,"""Die EU braucht eine Zusammenführung von Einnahmen- und Ausgabenverantwortung, um eine sparsame Mittelverwendung sicherzustellen. Daher soll sich die Europäische Union nicht länger primär über Beiträge der Mitgliedstaaten finanzieren, sondern selbst Steuern einheben. Dafür sollen Abgaben, die europaweit harmonisiert sind, direkt ins EU-Budget fließen. Ein möglichst verantwortungsvoller Umgang mit dem Budget und ein effektiver Einsatz der Mittel ist dann am besten gewährleistet, wenn jene, die das Budget ausgeben, die Steuern auch einheben. Die Europäische Kommission bekommt eine_n Finanzminister_in, der/die für die Einnahmen-Administration verantwortlich ist und sich für ein volldigitales System einsetzt.""",https://www.neos.eu/_Resources/Persistent/c9372d01003ea771300fc6422dd43a5c976673a3/20190126_EU-Programm%202019%20%28Pla%CC%88ne%20fu%CC%88r%20ein%20neues%20Europa%29%20-%20beschlossen%20auf%20der%20MV-v6-20190128_170145.pdf,AT,Austria,472,The New Austria and Liberal Forum,NEOS,http://files2.societly.com.s3-website.eu-central-1.amazonaws.com/0000/0000/0010/candidates/0000/0000/0472/bild1-1554975321.png,The EU should acquire its own tax raising powers,10
25.0,761,Pressemitteilung auf FAZ.net 2018,"""Sebastian Kurz, der Chef der christlich-sozialen Partei ÖVP  teile die Ziele eines transparenteren, wettbewerbsfähigeren und subsidiär organisierten Europas.[...] „bei gewissen Überlegungen, was die Eurozone betrifft, also etwa ein mögliches Eurozonen-Budget, bin ich deutlich skeptischer.“ """,https://www.faz.net/aktuell/politik/kurz-die-eu-muss-sparsamer-und-effizienter-werden-15402211.html,AT,Austria,475,Austrian People's Party,ÖVP,http://files2.societly.com.s3-website.eu-central-1.amazonaws.com/0000/0000/0010/candidates/0000/0000/0475/%C3%B6vp-1554926338.jpeg,The EU should acquire its own tax raising powers,10
0.0,761,Das freiheitliche Wirtschaftsprogramm,"""Die FPÖ ist nicht bereit, unter Bruch geltender Regeln eine Schuldenunion oder die Steuerhoheit Brüssels über die Mitgliedstaaten zuzulassen.""",https://www.fpoe.at/fileadmin/user_upload/2017_freiheitliche_wirtschaftsprogramm_web.pdf ,AT,Austria,482,Austrian Freedom Party,FPÖ,http://files2.societly.com.s3-website.eu-central-1.amazonaws.com/0000/0000/0010/candidates/0000/0000/0482/fp%C3%96-1554976218.png,The EU should acquire its own tax raising powers,10
100.0,762,SPÖ Grundsatzprogramm 2018,"""Die Finanztransaktionssteuer und eine faire Besteuerung global agierender und digitaler Konzerne müssen endlich umgesetzt werden. Denn mit diesem Geld könnten die Herausforderungen unserer Zeit zum Wohle aller nachhaltig und fair finanziert werden.""",https://www.spoe.at/wp-content/uploads/sites/739/2018/12/Parteiprogramm2018.pdf,AT,Austria,332,Social Democratic Party of Austria,SPÖ,http://files2.societly.com.s3-website.eu-central-1.amazonaws.com/0000/0000/0010/candidates/0000/0000/0332/spoe_logo-150x150-1554880634.png,Bank and stock market gains should be taxed more heavily,11
100.0,762,"Kommentar des Spitzenkandidaten, Johannes Voggenhuber, in: ZEIT ONLINE","""Europa braucht eine gemeinsame Wirtschaftsregierung, eine umfassende Aufsichtskompetenz, harmonisierte Steuersätze im Unternehmens- und Vermögensbereich und die Einführung einer Finanztransaktionssteuer.""",https://www.zeit.de/2010/19/A-Voggenhuber-Europa-Verantwortung/komplettansicht,AT,Austria,339,Initiative 1 Europe,Initiative 1 Europe,http://files2.societly.com.s3-website.eu-central-1.amazonaws.com/0000/0000/0010/candidates/0000/0000/0339/initiative_ein_europa_logo-1554880598.png,Bank and stock market gains should be taxed more heavily,11
100.0,762,Offizielle Webseite der Grünen Österreich,"""Die Finanztransaktionssteuer (FTT) ist eine Steuer gegen Spekulation, mit der der kurzfristige Handel mit Derivaten unrentabel werden soll. Spekulation wird also eingedämmt. Das Finanzsystem wird stabiler. Wir haben uns lange dafür eingesetzt, leider wird dieser Vorschlag von den Mitgliedsstaaten blockiert.""",https://www.gruene.at/themen/europa/weg-frei-fuer-eine-finanztransaktionssteuer,AT,Austria,344,The Greens - The Green Alternative,GRÜNE,http://files2.societly.com.s3-website.eu-central-1.amazonaws.com/0000/0000/0010/candidates/0000/0000/0344/gruene_logo-1554880615.png,Bank and stock market gains should be taxed more heavily,11
,762,,,,AT,Austria,472,The New Austria and Liberal Forum,NEOS,http://files2.societly.com.s3-website.eu-central-1.amazonaws.com/0000/0000/0010/candidates/0000/0000/0472/bild1-1554975321.png,Bank and stock market gains should be taxed more heavily,11
,762,,,,AT,Austria,475,Austrian People's Party,ÖVP,http://files2.societly.com.s3-website.eu-central-1.amazonaws.com/0000/0000/0010/candidates/0000/0000/0475/%C3%B6vp-1554926338.jpeg,Bank and stock market gains should be taxed more heavily,11
75.0,762,"Interview, Pressemeldung und Social Media Kommunikation","„Unregulierter Finanzsektor als Gefahr für Wirtschaft.“ (…) ""Denn abseits regulierter und kontrollierter Geldinstitute und Banken steigt das Risiko und somit auch die Gefahr von massiven finanziellen Verlusten und undurchsichtigen Geschäftspraktiken."" (...) ""Erforderlich ist mit Sicherheit eine verstärkte Regulierung dieses Sektors, bevor er ‚too big to fail‘ wird, etwa durch höhere Eigenkapitalanforderungen, strengere Kontrollen und mehr Transparenz im Geschäftsgebaren."" ","""Pressemeldung: Kappel: „Schattenbanken verzeichnen weltweites Rekordwachstum“ (Interviews, press releases and social media communication): https://www.fpoe.eu/kappel-schattenbanken-verzeichnen-weltweites-rekordwachstum/ (Zugegriffen: 12.03.2019).""",AT,Austria,482,Austrian Freedom Party,FPÖ,http://files2.societly.com.s3-website.eu-central-1.amazonaws.com/0000/0000/0010/candidates/0000/0000/0482/fp%C3%96-1554976218.png,Bank and stock market gains should be taxed more heavily,11
75.0,763,SPÖ Wahlprogramm zur Nationalratswahl 2017,"""Öffi-Offensive! Umsetzung eines österreichweit einheitlichen Angebots von öffentlichem Verkehr im ländlichen Raum. Wir wollen zusätzlich in Bus- und Schienenverkehre, den Streckenausbau und Park&Ride-Anlagen sowie in die Förderung von lokalen »Mikro-Öffis« investieren. Elektromobilität ist eines der wichtigsten Zukunftsthemen. Sowohl aus Umweltsicht als auch aus wirtschaftlicher Sicht – denn Österreich gilt als verlässlicher und gefragter Zulieferer für die internationale Automobilindustrie.""",,AT,Austria,332,Social Democratic Party of Austria,SPÖ,http://files2.societly.com.s3-website.eu-central-1.amazonaws.com/0000/0000/0010/candidates/0000/0000/0332/spoe_logo-150x150-1554880634.png,The promotion of public transport should be fostered through green taxes (e.g. road taxing),12
100.0,763,sic Johannes Voggenhuber,"Der Klimaschutz macht eine Verlagerung von der Straße auf die Schiene und vom Individualverkehr auf öffentlichen Verkehr notwendig, dazu sind ökologische Lenkungssteuern ein angemessenes Mittel.",,AT,Austria,339,Initiative 1 Europe,Initiative 1 Europe,http://files2.societly.com.s3-website.eu-central-1.amazonaws.com/0000/0000/0010/candidates/0000/0000/0339/initiative_ein_europa_logo-1554880598.png,The promotion of public transport should be fostered through green taxes (e.g. road taxing),12
100.0,763,Grünes Umweltprogramm von 2017,"""Klimaschonende Mobilität muss für alle möglich und leistbar werden. Mit dem Abstellen kontraproduktiver Steuervorteile im Verkehr und der überfälligen ökologisch-sozialen Steuerreform wird unsere Mobilität wirksam umgesteuert. Bis hin zum Flugverkehr muss ""Fair pay statt nix pay"" die Basis werden. Der öffentliche Nahverkehr muss in allen Regionen ausgebaut und attraktiviert werden (365- Euro-Ticket​). Wir brauchen bessere Rahmenbedingungen für den Ausbau der Elektromobilität​ –​ leistbare E-Autos und E-Infrastruktur; ab 2030 soll es nur noch Elektro-Neuwagen geben. Der Umweltverbund aus Bahn, öffentlichen Personennahverkehr, Fuß- und Radverkehr wird gestärkt.""",https://www.gruene.at/umweltprogramm,AT,Austria,344,The Greens - The Green Alternative,GRÜNE,http://files2.societly.com.s3-website.eu-central-1.amazonaws.com/0000/0000/0010/candidates/0000/0000/0344/gruene_logo-1554880615.png,The promotion of public transport should be fostered through green taxes (e.g. road taxing),12
100.0,763,Wahlprogramm zur Europawahl 2019,"""Wir fordern die Stärkung der Ökologisierung der Steuersysteme durch eine CO2-Abgaben-Richtlinie. Die aktuelle Richtlinie zur Besteuerung von Energieerzeugnissen und elektrischem Strom ist veraltet und nicht ausreichend. Eine Richtlinie für CO2-Abgaben muss jedenfalls eine einheitliche Bemessungsgrundlage für Emissionen und Mindeststeuersätze beinhalten, um CO2 – unabhängig davon, um welche Energiequelle es sich handelt – gleichmäßig zu belasten. Damit soll mittel- bis langfristig auf eine europaweite CO2-Abgabe abgezielt werden. NEOS fordern den Ausbau europäischer Transitrouten (Zug und Bus) als attraktive Alternativen zum steigenden Flugverkehr, [...]  die Erprobung zukunftsfähiger, emissionsärmerer Verkehrskonzepte (etwa Verkehr auf mehreren Ebenen – Entkoppelung von Fußgänger_innen, Radfahrer_innen und Autos) ein, [...] das Anbieten und Fördern von regionalen, kommunalen, (über-)betrieblichen und privaten Fahrgemeinschaften, um massiven Pendler-Individualverkehr und tägliche Staus in Ballungszentren zu verringern, [...] eine Umstellung von Autobahnvignette auf kilometerabhängiges Mautsystem.""","""https://www.neos.eu/_Resources/Persistent/eab2025c4e55b38416d84b02fcca3b427c32f28a/NEOS-PLAENE-OESTERREICH-2016-Online-Einzel.pdf  https://europa.neos.eu/_Resources/Persistent/e4e6d86c469f335a77d3435dbee6d4e8fa95fc42/NEOS%20EU-Programm%202019.pdf""",AT,Austria,472,The New Austria and Liberal Forum,NEOS,http://files2.societly.com.s3-website.eu-central-1.amazonaws.com/0000/0000/0010/candidates/0000/0000/0472/bild1-1554975321.png,The promotion of public transport should be fostered through green taxes (e.g. road taxing),12
25.0,763,Pressemitteilung des Bundesministerium für Finanzen 2019,"""Weiters sollen in einem ersten Schritt Maßnahmen aus der österreichischen Klima- und Energiestrategie zur Ökologisierung des Steuersystems gesetzt werden. Ziel ist unter anderem, im Bereich der Mobilität ökologische Anreize zu schaffen und Fahrzeuge mit geringem Schadstoffausstoß steuerlich zu begünstigen. Darüber hinaus sind steuerliche Anpassungen in den Bereichen Photovoltaik, Biogas und Wasserstoff geplant.""",https://www.bmf.gv.at/top-themen/entlastung.html,AT,Austria,475,Austrian People's Party,ÖVP,http://files2.societly.com.s3-website.eu-central-1.amazonaws.com/0000/0000/0010/candidates/0000/0000/0475/%C3%B6vp-1554926338.jpeg,The promotion of public transport should be fostered through green taxes (e.g. road taxing),12
0.0,763,Parteiprogramm 2017,"""Insbesondere darf es nicht sein, dass Fahrer von Diesel-Fahrzeugen jetzt dafür büßen sollen, dass die Autohersteller-Konzerne bei der Abgasmessung betrogen haben."" (…) ""Gleichzeitig muss aber auch der öffentliche Verkehr ausgebaut und bedarfsgerecht adaptiert werden."" (...) ""Garantie für die Nutzung von Diesel-Kfz bis 2050 – keine Schikanen für Diesel-Fahrer. Einführung eines Österreich-Tickets für alle öffentlichen Verkehrsverbindungen.""",https://www.fpoe.at/fileadmin/user_upload/Wahlprogramm_8_9_low.pdf,AT,Austria,482,Austrian Freedom Party,FPÖ,http://files2.societly.com.s3-website.eu-central-1.amazonaws.com/0000/0000/0010/candidates/0000/0000/0482/fp%C3%96-1554976218.png,The promotion of public transport should be fostered through green taxes (e.g. road taxing),12
50.0,764,SPÖ Wahlprogramm zur Nationalratswahl 2017,"""Strom aus A! Energie radikal ökologisieren und leistbar machen""",,AT,Austria,332,Social Democratic Party of Austria,SPÖ,http://files2.societly.com.s3-website.eu-central-1.amazonaws.com/0000/0000/0010/candidates/0000/0000/0332/spoe_logo-150x150-1554880634.png,Renewable sources of energy (e.g. solar or wind energy) should be supported even if this means higher energy costs,13
100.0,764,sic Johannes Voggenhuber,Diese Maßnahmen sind zielführend im Rahmen einer umfassenden Klimaschutz-Strategie (u.a. Paris- und Kattowitz-Ziele) sowie für den Umstieg auf erneuerbare Energien.,,AT,Austria,339,Initiative 1 Europe,Initiative 1 Europe,http://files2.societly.com.s3-website.eu-central-1.amazonaws.com/0000/0000/0010/candidates/0000/0000/0339/initiative_ein_europa_logo-1554880598.png,Renewable sources of energy (e.g. solar or wind energy) should be supported even if this means higher energy costs,13
100.0,764,EU-Wahlprogramm der Europapartei,"""Wir müssen unseren Strom aus 100% erneuerbaren Energien beziehen, diesen effizient nutzen, stufenweise aus fossiler und Kernenergie aussteigen und gleichzeitig nachhaltige Arbeitsplätze in den betroffenen Regionen schaffen. Ohne die völlig kontraproduktive Förderung von fossilen Energie wären erneuerbare Energien schon jetzt die wirtschaftlich günstigere Alternative.""",https://vote.europeangreens.eu/manifesto,AT,Austria,344,The Greens - The Green Alternative,GRÜNE,http://files2.societly.com.s3-website.eu-central-1.amazonaws.com/0000/0000/0010/candidates/0000/0000/0344/gruene_logo-1554880615.png,Renewable sources of energy (e.g. solar or wind energy) should be supported even if this means higher energy costs,13
75.0,764,Grundsatzprogramm 2016,"""Die Wirkung des fossilen Energieverbrauchs führen und wirtschaftliches Wachstum fördern, [den] Ausbau der erneuerbaren Energieproduktion auf 50% des Energiebedarfes bis 2020, [den] Ausbau der erneuerbaren Energieproduktion auf 75% des Energiebedarfes bis 2030, [den] Ausbau der erneuerbaren Stromproduktion auf 100% des Strombedarfes bis 2020. [eine] Aktive internationale Außenpolitik zum Abschluss einer internationalen Energie- & Umweltvereinbarung in Paris im Jahr 2015 welche 2020 in Kraft treten soll.""",https://www.neos.eu/_Resources/Persistent/eab2025c4e55b38416d84b02fcca3b427c32f28a/NEOS-PLAENE-OESTERREICH-2016-Online-Einzel.pdf,AT,Austria,472,The New Austria and Liberal Forum,NEOS,http://files2.societly.com.s3-website.eu-central-1.amazonaws.com/0000/0000/0010/candidates/0000/0000/0472/bild1-1554975321.png,Renewable sources of energy (e.g. solar or wind energy) should be supported even if this means higher energy costs,13
,764,,,,AT,Austria,475,Austrian People's Party,ÖVP,http://files2.societly.com.s3-website.eu-central-1.amazonaws.com/0000/0000/0010/candidates/0000/0000/0475/%C3%B6vp-1554926338.jpeg,Renewable sources of energy (e.g. solar or wind energy) should be supported even if this means higher energy costs,13
50.0,764,Wahlprogramm zur Nationalratswahl 2017,"""Bei der Energiegewinnung setzt die FPÖ auf Nachhaltigkeit. Der Einsatz heimischer erneuerbarer Energieformen ist der sicherste Weg zur Erreichung von Umweltschutzzielen.""",https://www.fpoe.at/fileadmin/user_upload/Wahlprogramm_8_9_low.pdf ,AT,Austria,482,Austrian Freedom Party,FPÖ,http://files2.societly.com.s3-website.eu-central-1.amazonaws.com/0000/0000/0010/candidates/0000/0000/0482/fp%C3%96-1554976218.png,Renewable sources of energy (e.g. solar or wind energy) should be supported even if this means higher energy costs,13
25.0,765,SPÖ Grundsatzprogramm 2018,"""Wir kämpfen für Selbstbestimmung und das Recht auf Privatsphäre. Wir setzen uns für einen modernen und selbstbestimmten Datenschutz ein. Der Schutz der Privatsphäre ist wichtiger als wirtschaftliche Interessen. Der gläserne Bürger ist eine Gefahr für die Freiheit, weshalb wir für einen starken, einheitlichen und konsequent sanktionierten europäischen Datenschutz und einen digitalen Grundrechtskatalog eintreten. Alle Menschen müssen das Recht haben, über die Verwendung ihrer Daten selbst zu entscheiden. Der Zugang zu digitalen Diensten soll möglich sein, ohne dass Nutzerinnen und Nutzer einer umfassenden Speicherung von Daten zustimmen müssen. Das „Recht auf Löschen“ muss zu einem Grundrecht werden. Auch durch ein Übermaß an Überwachung wird unsere Demokratie und Freiheit gefährdet. Wir sind daher gegen eine anlasslose personenbezogene Massenüberwachung, denn diese macht uns alle nicht sicherer, sondern erleichtert wirtschaftlich und politisch motivierten Datenmissbrauch.""",https://www.spoe.at/wp-content/uploads/sites/739/2018/12/Parteiprogramm2018.pdf,AT,Austria,332,Social Democratic Party of Austria,SPÖ,http://files2.societly.com.s3-website.eu-central-1.amazonaws.com/0000/0000/0010/candidates/0000/0000/0332/spoe_logo-150x150-1554880634.png,Restrictions of personal privacy on the Internet should be accepted for public security reasons,14
25.0,765,"Voggenhuber, J. (2010). Res Publica. Gegen die Schwerkraft, Residenz Verlag, S. 77f.","""Ich bin bestürzt (...) über das Bestehen eines elektronischen Überwachungssystems, mit dem die Telefongespräche, ja die gesamte Telekommunikation aller Menschen in Europa abgehört werden können, ohne Schutz ihrer Grundrechte, ohne gerichtliche Anordnung, ohne parlamentarische Kontrolle und ohne Datenschutz. Das ist ein unerhörter Eingriff in die Privatspähre der Menschen, der schon totalitätre Züge aufweist.""",,AT,Austria,339,Initiative 1 Europe,Initiative 1 Europe,http://files2.societly.com.s3-website.eu-central-1.amazonaws.com/0000/0000/0010/candidates/0000/0000/0339/initiative_ein_europa_logo-1554880598.png,Restrictions of personal privacy on the Internet should be accepted for public security reasons,14
0.0,765,Interview/ Pressemitteilung,"""Der gläserne Mensch als Abtausch gegen eine angebliche Sicherheit vor Terror ist demokratiepolitisch gefährlich. Die österreichische Ratspräsidentschaft hat dazu eine Verordnung auf den Weg gebracht, die Uploadfilter zur Terrorismusbekämpfung einsetzt. Diese Verordnung wurde am 26. März nun im EU Parlament abgesegnet. Die schwammige Definition von 'Terror' wird hier zum Bumerang für Bürger*innenrechte. Uploadfilter werden die EU nicht freier oder sicherer machen, sondern die Meinungsfreiheit einschränken. Wie schon beim Copyright werden kleine Plattformen sich diese Filter nicht leisten können und damit Probleme bekommen""",https://derstandard.at/2000093964048/OeVP-und-FPOe-fuer-Uploadfilter-gegen-Terror-im-Netz,AT,Austria,344,The Greens - The Green Alternative,GRÜNE,http://files2.societly.com.s3-website.eu-central-1.amazonaws.com/0000/0000/0010/candidates/0000/0000/0344/gruene_logo-1554880615.png,Restrictions of personal privacy on the Internet should be accepted for public security reasons,14
75.0,765,Grundsatzprogramm 2016,"""Die umfassende Aufzeichnung und Speicherung von Telekommunikationsdaten der gesamten Bevölkerung bedeutet einen massiven Eingriff in die Privatsphäre der Menschen und stellt sie de facto unter einen Pauschalverdacht, der das Prinzip der Unschuldsvermutung selbst verletzt. Derartige Methoden stellen einen unverhältnismäßigen Eingriff in die Rechte Einzelner dar.Rein anlassbezogene Maßnahmen mit hohen rechtsstaatlichen Hürden können eine Alternative sein. Dazu gehört beispielsweise das sogenannte „Quick Freeze“, wodurch in begrenztem Umfang Verbindungsdaten gespeichert und analysiert werden können. Dadurch werden Sicherheitsbehörden begründete Ermittlungen ermöglicht, aber eine anlasslose Massenüberwachung verhindert und die Rechte des/der Einzelnen geschützt.""",https://www.neos.eu/_Resources/Persistent/eab2025c4e55b38416d84b02fcca3b427c32f28a/NEOS-PLAENE-OESTERREICH-2016-Online-Einzel.pdf,AT,Austria,472,The New Austria and Liberal Forum,NEOS,http://files2.societly.com.s3-website.eu-central-1.amazonaws.com/0000/0000/0010/candidates/0000/0000/0472/bild1-1554975321.png,Restrictions of personal privacy on the Internet should be accepted for public security reasons,14
75.0,765,EVP-Grundsatzprogramm 2012,"""Der Schutz von personenbezogenen Daten im Internet kann nur in Fällen krimineller Aktivitäten verletzt werden.""",https://www.dieneuevolkspartei.at/Download/EVP-Grundsatzprogramm.pdf,AT,Austria,475,Austrian People's Party,ÖVP,http://files2.societly.com.s3-website.eu-central-1.amazonaws.com/0000/0000/0010/candidates/0000/0000/0475/%C3%B6vp-1554926338.jpeg,Restrictions of personal privacy on the Internet should be accepted for public security reasons,14
