answer,question_id,motivation_src,motivation,motivation_src_link,country_code,country_name,party_id,party_name_full,party_name_short,party_image,question,question_shared_id
25.0,1356,Sverigedemokraternas budgetmotion 2019,Sverigedemokraterna vill återställa skattehöjningen vad gäller avkastningsskatten på ISK.,https://sd.se/wp-content/uploads/2018/11/Budgetmotion-2019.pdf,SE,Sweden,280,Sweden Democrats,SD,http://files2.societly.com.s3-website.eu-central-1.amazonaws.com/0000/0000/0035/candidates/0000/0000/0280/sverigedem-1554896400.png,Bank and stock market gains should be taxed more heavily,11
75.0,1356,Kommentar från partiet,"Kommentar från MP: Mp har i regering i Sverige genomfört reformer i den riktningen, t.ex. skatt på investeringssparkonto, ISK. Mp vill verka för en rättvis beskattning både nationellt och på EU-nivå. Vi verkar för en högre beskattning för de som ackumulerar stora volymer pengar, för att använda till en grön och solidarisk omställning. ",,SE,Sweden,410,Green Party,MP,http://files2.societly.com.s3-website.eu-central-1.amazonaws.com/0000/0000/0035/candidates/0000/0000/0410/milj%C3%B6partiet-1554896485.jpg,Bank and stock market gains should be taxed more heavily,11
,1356,,,,SE,Sweden,411,Christian Democrats,KD,http://files2.societly.com.s3-website.eu-central-1.amazonaws.com/0000/0000/0035/candidates/0000/0000/0411/kristdemokraterna_logo-1554896646.jpg,Bank and stock market gains should be taxed more heavily,11
100.0,1356,Partiprogram,"""Fi ska verka för proportionalitet i regelverk och krav för banker, så att de tar hänsyn både till bankens omsättning, risk- och vinstnivåer samt inriktning mot social och ekologisk hållbarhet."" (sida 12); ""Fi ska verka för att arbeta för multinationella avtal om automatiskt informationsutbyte av skatteinformation mellan länder och skatteparadisen, så att skatt kan tas ut på företags, stiftelsers och privatpersoners förmögenheter, vinster, royalties och utdelningar"" (sida 17)",https://feministisktinitiativ.se/wp-content/uploads/2018/10/fi-for-en-feministisk-politik-rev07_2017-pdf.pdf,SE,Sweden,412,Feminist Initiative,FI,http://files2.societly.com.s3-website.eu-central-1.amazonaws.com/0000/0000/0035/candidates/0000/0000/0412/feministisktinitiativ-1554896704.png,Bank and stock market gains should be taxed more heavily,11
75.0,1356,Nyhetsartikel (SVT),"""Socialdemokraterna går till val på att höja skatter med fem miljarder. Banker och kapitalägare ska stå för notan, enligt finansminister Magdalena Andersson (S).""",https://www.svt.se/nyheter/val2018/s-hojda-skatter-for-banker-och-kapitalagare,SE,Sweden,414,Social Democrats,S,http://files2.societly.com.s3-website.eu-central-1.amazonaws.com/0000/0000/0035/candidates/0000/0000/0414/socialdemokraterna-1554896161.jpg,Bank and stock market gains should be taxed more heavily,11
100.0,1356,Partiets hemsida,"""Vänsterpartiet vill höja skatten för de allra rikaste. Det gör vi genom att bland annat införa en höjd skatt på aktieutdelning- och kapitalvinst på värdepappersförsäljning, en ny förmögenhetsskatt och en bankskatt.""",https://www.vansterpartiet.se/politik/skatter/,SE,Sweden,415,Left,V,http://files2.societly.com.s3-website.eu-central-1.amazonaws.com/0000/0000/0035/candidates/0000/0000/0415/1200px-left_party_(sweden)_logo.svg-1554896298.png,Bank and stock market gains should be taxed more heavily,11
75.0,1357,Partiets webb,"Alla har rätt till att andas ren och frisk luft. I många städer har luften blivit så dålig att människors hälsa riskeras, det vill Liberalerna ändra på. Liberalerna vill att kommuner och regioner med trafikproblem själva ska kunna besluta om och införa trängselskatter. Det är viktigt att trängselskatten inte bara blir en extra skattekälla. Intäkterna från trängselskatten ska användas till att förbättra den lokala infrastrukturen och komma till rätta med flaskhalsar i trafiken. Det är också bättre att kommunerna ges möjlighet att använda dubbdäcksavgift som alternativ till dubbdäcksförbud.",https://www.liberalerna.se/politik/vagar/ ,SE,Sweden,277,The Liberals,L,http://files2.societly.com.s3-website.eu-central-1.amazonaws.com/0000/0000/0035/candidates/0000/0000/0277/logo-l-large-ny3-1555010057.jpg,The promotion of public transport should be fostered through green taxes (e.g. road taxing),12
75.0,1357,Partiets webb,"""Vi tycker att det är bra med vissa avgifter som bidrar till att minska trängseln i städerna. Det kan handla om avgifter för vägar eller trängsel, allmänt kallad trängselskatt. Det är bra av flera skäl. Dels minskar trängseln i städerna och dels kan inkomsterna från avgifterna betala för nya satsningar på infrastruktur. De i sin tur bidrar till ökad samhällsnytta och tillväxt.  Vi behöver nyttja de resurser och infrastruktur vi har mer effektivt. Då behöver fler transportera sig kollektivt. Ökade avgifter i form av trängselskatt kan då styra om resmönster och användas för en snabbare och bekvämare kollektivtrafik så att fler använder den.""",https://www.centerpartiet.se/var-politik/politik-a-o/infrastruktur-och-trafik/trangselskatt,SE,Sweden,278,Centre Party,C,http://files2.societly.com.s3-website.eu-central-1.amazonaws.com/0000/0000/0035/candidates/0000/0000/0278/centern-1554927492.png,The promotion of public transport should be fostered through green taxes (e.g. road taxing),12
25.0,1357,Valmanifest 2018,"""Eftersom resurserna är begränsade är det viktigt att offentliga insatser görs genom åtgärder som ger så stor miljö- eller klimatnytta som möjligt för de pengar som satsas. Varje ineffektivt spenderad krona är en förlust för miljön. Innan styrmedel införs ska de vara väl utredda med beräkningar för miljö- och klimatnytta samt kostnadseffektivitet. Moderaterna är emot en flygskatt eftersom skatten bygger på att straffa avstånd istället för utsläpp och därmed inte heller ger flygbolagen några som helst incitament att sänka sina utsläpp. Till råga på allt är skatten ineffektiv, då den endast förväntas leda till marginella utsläppsminskningar.""",https://moderaterna.se/sites/default/files/page_attachments/2018-08/Valmanifest%20HÖG%20180820.pdf,SE,Sweden,279,Moderate Party,M,http://files2.societly.com.s3-website.eu-central-1.amazonaws.com/0000/0000/0035/candidates/0000/0000/0279/m_logo_bla_1-1554927399.png,The promotion of public transport should be fostered through green taxes (e.g. road taxing),12
25.0,1357,SD budgetmotion 2019 samt intervju bifogad,Sverigedemokraterna motsätter sig förslag som innebär straffbeskattning av dem som är bilberoende.,https://www.expressen.se/debatt/mps-klimatpolitik-sker-pa-de-svagas-bekostnad/,SE,Sweden,280,Sweden Democrats,SD,http://files2.societly.com.s3-website.eu-central-1.amazonaws.com/0000/0000/0035/candidates/0000/0000/0280/sverigedem-1554896400.png,The promotion of public transport should be fostered through green taxes (e.g. road taxing),12
100.0,1357,Valmanifest 2018,"""Nästa mandatperiod vill vi n	 genomföra en bred skattereform med grön skatteväxling som grund. Vi vill se blocköverskridande skattesamtal och nå överenskommelser som gynnar cirkulär och delandets ekonomi, minskar hushållens skuldsättning, utjämnar dagens växande ekonomiska klyftor och långsiktigt tryggar välfärden."" (sida 24)",https://www.mp.se/sites/default/files/nu_valmanifest_a5_webb_.pdf,SE,Sweden,410,Green Party,MP,http://files2.societly.com.s3-website.eu-central-1.amazonaws.com/0000/0000/0035/candidates/0000/0000/0410/milj%C3%B6partiet-1554896485.jpg,The promotion of public transport should be fostered through green taxes (e.g. road taxing),12
25.0,1357,Partiets hemsida,"""På individnivå behöver konsumtionsbeteenden förändras och köpkraften i högre grad inriktas på tjänster snarare än fysiska produkter. Denna samhällsutveckling har redan påbörjats. Nu behövs en bättre samordning mellan olika politikområden, samt att administrativa och skattemässiga hinder som riskerar att hämma utvecklingen snabbt röjs undan."" (sida 4); ""En effektiv samhällsplanering har förstås stor betydelse, som till exempel en smart kollektivtrafik och incitament för mer gång- och cykeltrafik"" (sida 6)",https://kristdemokraterna.se/wp-content/uploads/2016/11/Milj%C3%B6politik-med-f%C3%B6rvaltarskap-2016.pdf,SE,Sweden,411,Christian Democrats,KD,http://files2.societly.com.s3-website.eu-central-1.amazonaws.com/0000/0000/0035/candidates/0000/0000/0411/kristdemokraterna_logo-1554896646.jpg,The promotion of public transport should be fostered through green taxes (e.g. road taxing),12
100.0,1357,Partiets hemsida,"""Fi ska verka för att bilismen minskar och att privatbilismen främst i storstäder ersätts med cykel, gång, bilpooler och kollektiva färdmedel, genom högre kostnader som dyrare parkeringsplatser samt stopp av motorvägsbyggen.""",https://feministisktinitiativ.se/politik/miljo/transport/,SE,Sweden,412,Feminist Initiative,FI,http://files2.societly.com.s3-website.eu-central-1.amazonaws.com/0000/0000/0035/candidates/0000/0000/0412/feministisktinitiativ-1554896704.png,The promotion of public transport should be fostered through green taxes (e.g. road taxing),12
100.0,1357,Partiets hemsida,"""Socialdemokraterna vill: ... minskade utsläpp från vägtrafiken genom ytterligare höjda krav på att blanda in förnybart i bensin och diesel, genom en bonus till den som köper miljöbil och att EU sätter ett slutdatum för bensin och dieseldrivna bilar""",https://www.socialdemokraterna.se/var-politik/a-till-o/klimat/,SE,Sweden,414,Social Democrats,S,http://files2.societly.com.s3-website.eu-central-1.amazonaws.com/0000/0000/0035/candidates/0000/0000/0414/socialdemokraterna-1554896161.jpg,The promotion of public transport should be fostered through green taxes (e.g. road taxing),12
100.0,1357,Partiets hemsida,"""Vänsterpartiet tycker att staten har ett ansvar för att öka resandet med kollektivtrafik. Biljettpriset har betydelse för att fler ska ställa bilen och istället välja att åka kollektivt. Genom att sänka taxorna eller införa gratis kollektivtrafik skapas också ökade möjligheter för dem med låga inkomster att resa.""",https://www.vansterpartiet.se/politik/kollektivtrafik/,SE,Sweden,415,Left,V,http://files2.societly.com.s3-website.eu-central-1.amazonaws.com/0000/0000/0035/candidates/0000/0000/0415/1200px-left_party_(sweden)_logo.svg-1554896298.png,The promotion of public transport should be fostered through green taxes (e.g. road taxing),12
25.0,1358,Partiets webb,"Som liberaler tror vi på mer marknad och mindre subventioner. Det viktiga är en fossilfri och stabil elproduktion som drivs på av marknaden och byggs när den behövs och där den behövs. Vi är kritiska till att stora subventioner läggs på ny elproduktion. Subventionerna är dyra och snedvrider konkurrensen. Vi väljer att lyssna på alla de experter som dömer ut det så kallade elcertifikatssystemet. Det är dyrt, bidrar inte till mindre utsläpp och slår mot vattenkraftens och kärnkraftens lönsamhet. Vi kan inte heller stå bakom energiöverenskommelsen som innebär att miljarder ska pumpas in i subventioner till att bygga ny elproduktion som inte behövs eftersom vi redan idag har ett elöverskott. Vi vill istället utveckla vår klimatsmarta energimix av vattenkraft, kärnkraft och förnybart.",https://www.liberalerna.se/politik/fornybar-energi/ ,SE,Sweden,277,The Liberals,L,http://files2.societly.com.s3-website.eu-central-1.amazonaws.com/0000/0000/0035/candidates/0000/0000/0277/logo-l-large-ny3-1555010057.jpg,Renewable sources of energy (e.g. solar or wind energy) should be supported even if this means higher energy costs,13
75.0,1358,Valplattform 2019,"""EU:s klimatambitioner får inte motarbetas av stelbenta statsstödsregler, skatteregler eller subventioner till fossila bränslen. Medlemsländerna måste kunna stimulera framväxten av ny grön teknik, utan att sätta den inre marknaden och konkurrensen ur spel. Subventionerna till fossila bränslen i EU beräknas till mellan 39 och 200 miljarder euro per år, vilket inte bara sätter prissignalerna ur spel utan också är långt mycket mer än det som satsas på den gröna omställningen. Vi måste både skrota subventionerna och öka satsningarna på förnybart för att EU:s åtaganden i Parisavtalet ska kunna nås.  Den förnybara energin är idag billigast att bygga. Det är därför felaktigt att ge sken av att det skulle kosta mer att bygga ut den, annars hade vi satt att vi håller helt med. Vårt mål är att Sveriges energisystem ska vara helt förnybart år 2040. För att nå det målet krävs energieffektiviseringar och en mångfald av förnybara energislag, i både liten och stor skala.""",https://www.centerpartiet.se/download/18.3c355441690f3d47e225fd/1551873084902/Valplattform%20EP_2019_DEF.pdf,SE,Sweden,278,Centre Party,C,http://files2.societly.com.s3-website.eu-central-1.amazonaws.com/0000/0000/0035/candidates/0000/0000/0278/centern-1554927492.png,Renewable sources of energy (e.g. solar or wind energy) should be supported even if this means higher energy costs,13
25.0,1358,Riksdagsmotion,Bidrag och subventioner är inte rätt väg att gå. Det fokuserar exempelvis inte på Sveriges största utmaningar på energisidan: att långsiktigt säkra och tillhandahålla el till internationellt konkurrenskraftiga priser. Vad gäller subventionerna för att stimulera utbyggnaden av solceller så är det också något som har mött kraftig kritik av oberoende expertbedömare. ,http://www.riksdagen.se/sv/dokument-lagar/dokument/motion/utgiftsomrade-21-energi_H6022943,SE,Sweden,279,Moderate Party,M,http://files2.societly.com.s3-website.eu-central-1.amazonaws.com/0000/0000/0035/candidates/0000/0000/0279/m_logo_bla_1-1554927399.png,Renewable sources of energy (e.g. solar or wind energy) should be supported even if this means higher energy costs,13
25.0,1358,Valmanifest 2018,Sverigedemokraterna vill satsa på kärnkraft och tror inte på subventioner av ineffektiv energiframställning.,https://sd.se/wp-content/uploads/2018/08/Valmanifest-2018-1.pdf,SE,Sweden,280,Sweden Democrats,SD,http://files2.societly.com.s3-website.eu-central-1.amazonaws.com/0000/0000/0035/candidates/0000/0000/0280/sverigedem-1554896400.png,Renewable sources of energy (e.g. solar or wind energy) should be supported even if this means higher energy costs,13
100.0,1358,Partiets hemsida,"""En europeisk gemensam elmarknad ger lägre priser för konsumenterna och industrin. Det ökar samtidigt möjligheterna att klara klimatmålen genom att det stärker konkurrenskraften för det förnybara. I ett gemensamt nät har vi överskott som flyter fram mellan olika delar av Europa där vinden kan balansera sig själv då kraven på annan balanskraft minskar väsentligt. Därmed kan vi få in betydligt mer av det förnybara i elsystemet, vilket i sin tur innebär att investeringarna i förnybart kan öka.""",https://www.mp.se/eu/ett-ar-sedan-valet,SE,Sweden,410,Green Party,MP,http://files2.societly.com.s3-website.eu-central-1.amazonaws.com/0000/0000/0035/candidates/0000/0000/0410/milj%C3%B6partiet-1554896485.jpg,Renewable sources of energy (e.g. solar or wind energy) should be supported even if this means higher energy costs,13
75.0,1358,Partiets hemsida,"""Kristdemokraterna står bakom den blocköverskridande energiöverenskommelsen som ingicks 2016 och som bl a syftar till att påskynda omställningen till förnybar energi och säkerställa fortsatt långsiktighet inom svensk energiförsörjning. Avvecklingen av effektskatten, sänkningen av fastighetsskatten för vattenkraften, moderna miljökrav som möjliggör effektökningar av befintlig vattenkraft samt regelanpassning som säkerställer den småskaliga vattenkraften och ökad överföringskapacitet inom landet är några av de goda förslag som ingår i överenskommelsen."" (sida 7)",https://kristdemokraterna.se/wp-content/uploads/2016/11/Milj%C3%B6politik-med-f%C3%B6rvaltarskap-2016.pdf,SE,Sweden,411,Christian Democrats,KD,http://files2.societly.com.s3-website.eu-central-1.amazonaws.com/0000/0000/0035/candidates/0000/0000/0411/kristdemokraterna_logo-1554896646.jpg,Renewable sources of energy (e.g. solar or wind energy) should be supported even if this means higher energy costs,13
100.0,1358,EU-valplattform,"""Feministiskt initiativ vill: … Att EU kraftigt ska påskynda omställningen till ett hållbart energisystem med fokus på förnyelsebar energi""",https://feministisktinitiativ.se/valplattform-europaparlementsvalet-2019/,SE,Sweden,412,Feminist Initiative,FI,http://files2.societly.com.s3-website.eu-central-1.amazonaws.com/0000/0000/0035/candidates/0000/0000/0412/feministisktinitiativ-1554896704.png,Renewable sources of energy (e.g. solar or wind energy) should be supported even if this means higher energy costs,13
100.0,1358,Partiets hemsida,"""Genom kvantifierade klimat- och energipolitiska mål för utsläpp av växthusgaser, förnybar energi och energieffektivisering, tillsammans med konkreta styrmedel för att uppnå dessa mål, läggs grunden för långsiktigt stabila förutsättningar för en snabb väg ut ur fossilsamhället och en utveckling mot ett hållbart energi- och transportsystem. Vi vill se långsiktiga förutsättningar för energibranschen och den svenska industrin.""",https://www.socialdemokraterna.se/var-politik/a-till-o/energi/,SE,Sweden,414,Social Democrats,S,http://files2.societly.com.s3-website.eu-central-1.amazonaws.com/0000/0000/0035/candidates/0000/0000/0414/socialdemokraterna-1554896161.jpg,Renewable sources of energy (e.g. solar or wind energy) should be supported even if this means higher energy costs,13
100.0,1358,Partiets hemsida,"""Det kostar att satsa på utveckling och utbyggnad av förnybar elproduktion. Men alternativet – att göra ingenting – är dyrare. Om vi inte satsar på förnybar energi nu kommer vi att få betala i framtiden i form av elbrist och stigande elpriser. Genom att satsa på förnybar el kan vi hålla nere kostnaderna för klimatförändringarna. På så sätt tar vi ansvar för kommande generationer.""",https://www.vansterpartiet.se/politik/energi/,SE,Sweden,415,Left,V,http://files2.societly.com.s3-website.eu-central-1.amazonaws.com/0000/0000/0035/candidates/0000/0000/0415/1200px-left_party_(sweden)_logo.svg-1554896298.png,Renewable sources of energy (e.g. solar or wind energy) should be supported even if this means higher energy costs,13
50.0,1359,Liberalernas program inför valet till Europaparlamentet 2019,Alla nya EU-förslag ska analyseras ur integritetsperspektiv. Åtgärder på EU-nivå som inskränker den personliga integriteten får endast vidtas om ett motstående intresse väger uppenbart tyngre och åtgärden är effektiv.,https://www.liberalerna.se/wp-content/uploads/1902-eu-program-1.pdf ,SE,Sweden,277,The Liberals,L,http://files2.societly.com.s3-website.eu-central-1.amazonaws.com/0000/0000/0035/candidates/0000/0000/0277/logo-l-large-ny3-1555010057.jpg,Restrictions of personal privacy on the Internet should be accepted for public security reasons,14
50.0,1359,Valplattform 2019,"""Integritet är en absolut prioritet. Men samtidigt måste vi ge de rättsvårdande myndigheterna reella möjligheter att utreda allvarliga brott.   ”I vår strävan att bekämpa den gränsöverskridande brottsligheten måste vi samtidigt vara vaksamma, så att brottsbekämpningen i sig inte går ut över människors fri- och rättigheter. Den personliga integriteten måste värnas.”""",https://www.centerpartiet.se/download/18.3c355441690f3d47e225fd/1551873084902/Valplattform%20EP_2019_DEF.pdf,SE,Sweden,278,Centre Party,C,http://files2.societly.com.s3-website.eu-central-1.amazonaws.com/0000/0000/0035/candidates/0000/0000/0278/centern-1554927492.png,Restrictions of personal privacy on the Internet should be accepted for public security reasons,14
75.0,1359,Riksdagsmotion,Den största integritetskränkningen är att bli utsatt för brott. Intresset av trygghet och att brott klaras upp måste därför väga tyngre än vad det gör i dag.,https://www.riksdagen.se/sv/dokument-lagar/dokument/motion/bekampa-brott-och-otrygghet-i-hela-landet_H5023569/html,SE,Sweden,279,Moderate Party,M,http://files2.societly.com.s3-website.eu-central-1.amazonaws.com/0000/0000/0035/candidates/0000/0000/0279/m_logo_bla_1-1554927399.png,Restrictions of personal privacy on the Internet should be accepted for public security reasons,14
75.0,1359,SD valplattform EP2019 samt webb,"Sverigedemokraterna värnar den personliga integriteten, men ser samtidigt behov av att ge myndigheterna adekvata förutsättningar att möta hot mot den allmänna säkerheten, t.ex. genom signalspaning och hemlig dataavläsning.",https://sd.se/our-politics/terrorism/,SE,Sweden,280,Sweden Democrats,SD,http://files2.societly.com.s3-website.eu-central-1.amazonaws.com/0000/0000/0035/candidates/0000/0000/0280/sverigedem-1554896400.png,Restrictions of personal privacy on the Internet should be accepted for public security reasons,14
0.0,1359,EU-valmanifest 2014; Partiprogram,"Länk 1: ""Övervakning, registrering och kartläggning av människor får aldrig vara generell eller godtycklig. Det måste finnas konkreta misstankar och domstolsbeslut för de specifika fall då övervakning används. Den övervakning som genomförs får aldrig vara mer omfattande än vad som krävs och ska alltid vägas mot betydelsen av att skydda individens integritet. Flera integritetskränkande lagar som har införts i Sverige har sin grund i EU-politik, såsom EU:s fildelningslag och datalagringsdirektiv. Dessa vill vi riva upp eller skriva om från grunden.""; Länk 2: ""Vi vill värna människors rätt till integritet och privatliv. I dag är den rätten hotad av både statliga och kommersiella aktörer. Som individ ska det vara lätt att få reda på vilken information myndigheter eller företag har registrerat om ens person. Ingen otillbörlig registrering eller övervakning baserad på politiska åsikter eller demokratisk verksamhet får förekomma. Demokratin måste försvaras med demokratiska medel. De ökade möjligheterna till övervakning kräver att politiken slår vakt om människors möjlighet att värna sin integritet. Vi motsätter oss alla lagar som innebär oproportionerliga ingrepp i integriteten. Brotts- och terrorbekämpning är viktigt men ska inte ske på bekostnad av mänskliga rättigheter.""",https://www.mp.se/eu/valmanifest-del-2; https://www.mp.se/sites/default/files/miljopartiets_partiprogram_lagupplost_2013.pdf,SE,Sweden,410,Green Party,MP,http://files2.societly.com.s3-website.eu-central-1.amazonaws.com/0000/0000/0035/candidates/0000/0000/0410/milj%C3%B6partiet-1554896485.jpg,Restrictions of personal privacy on the Internet should be accepted for public security reasons,14
,1359,,,,SE,Sweden,411,Christian Democrats,KD,http://files2.societly.com.s3-website.eu-central-1.amazonaws.com/0000/0000/0035/candidates/0000/0000/0411/kristdemokraterna_logo-1554896646.jpg,Restrictions of personal privacy on the Internet should be accepted for public security reasons,14
0.0,1359,Partiets hemsida,"""FRA-lagen och det kommande teledatalagringsdirektivet kränker vår personliga integritet och är allvarliga hot mot en demokratisk utveckling. Innehållsdata och trafikdata (kontaktinformation) är så kallad skyddsvärd information enligt Europakonventionen.""",https://feministisktinitiativ.se/politik/rattspolitik/internetratt/,SE,Sweden,412,Feminist Initiative,FI,http://files2.societly.com.s3-website.eu-central-1.amazonaws.com/0000/0000/0035/candidates/0000/0000/0412/feministisktinitiativ-1554896704.png,Restrictions of personal privacy on the Internet should be accepted for public security reasons,14
100.0,1359,Partiets hemsida,"""Kunskap om hur man utreder brott på nätet är därför väsentlig och tillgången till uppgifter om IP-adresser och abonnemangsuppgifter från teleoperatörer är avgörande för kriminella ska kunna hittas och dömas. Det måste finnas en möjlighet att ställa krav på operatörer att lagra information som kan lämnas ut till brottsbekämpande myndigheter."" (sida 5); ""Socialdemokraterna vill: ... ● Ge brottsbekämpande myndigheter tillgång till hemlig dataavläsning som gör det möjligt att läsa krypterad trafik"" (sida 16)",https://www.socialdemokraterna.se/globalassets/aktuellt/kriminalpolitiskt-program-2018-06-07.pdf,SE,Sweden,414,Social Democrats,S,http://files2.societly.com.s3-website.eu-central-1.amazonaws.com/0000/0000/0035/candidates/0000/0000/0414/socialdemokraterna-1554896161.jpg,Restrictions of personal privacy on the Internet should be accepted for public security reasons,14
25.0,1359,Partiets hemsida,"""Vänsterpartiet tycker därför att skyddet för den personliga integriteten måste vara mycket starkt. Vi är kritiska till införandet av lagstiftning om övervakning, hemliga tvångsmedel m.m. som innebär ett oproportionerligt stort intrång i den personliga integriteten.""",https://www.vansterpartiet.se/politik/integritet/,SE,Sweden,415,Left,V,http://files2.societly.com.s3-website.eu-central-1.amazonaws.com/0000/0000/0035/candidates/0000/0000/0415/1200px-left_party_(sweden)_logo.svg-1554896298.png,Restrictions of personal privacy on the Internet should be accepted for public security reasons,14
75.0,1360,Partiets webb,"Att förebygga brott är allra viktigast, men när brott begås måste samhället agera. Straffen för vissa brott behöver bli högre. Tiden i fängelse ska bidra till återanpassning. Fler brott ska leda till utvisning för den som inte är svensk medborgare.",https://www.liberalerna.se/politik/straff/ ,SE,Sweden,277,The Liberals,L,http://files2.societly.com.s3-website.eu-central-1.amazonaws.com/0000/0000/0035/candidates/0000/0000/0277/logo-l-large-ny3-1555010057.jpg,Criminals should be punished more severely,15
