answer,question_id,motivation_src,motivation,motivation_src_link,country_code,country_name,party_id,party_name_full,party_name_short,party_image,question,question_shared_id
0.0,1352,Partiets webb,"""Centerpartiets uppfattning är att Sverige fortsatt ska ha en restriktiv narkotikapolitik. Innehav, köp och försäljning av heroin, kokain, cannabis och andra droger är och ska vara olagligt. Samhället måste arbeta aktivt för att ingen ska börja missbruka och för att den som gör det ska få hjälp.  Vi vill se en utvärdering av lagen som kriminaliserar icke-medicinskt bruk av narkotika.""",https://www.centerpartiet.se/var-politik/politik-a-o/vard-och-omsorg/missbruk,SE,Sweden,278,Centre Party,C,http://files2.societly.com.s3-website.eu-central-1.amazonaws.com/0000/0000/0035/candidates/0000/0000/0278/centern-1554927492.png,The legalisation of the personal use of soft drugs is to be welcomed,7
0.0,1352,Artikel i Dagens Nyheter,Vi slår vakt om Sveriges restriktiva narkotikapolitik. Vi vill fortsätta ta krafttag mot narkotikan och kombinerar det med förebyggande arbete och effektiv behandling för dem som fallit in i missbruk.,https://www.dn.se/debatt/vi-vill-aterinfora-stranga-straff-for-knarkforsaljning/,SE,Sweden,279,Moderate Party,M,http://files2.societly.com.s3-website.eu-central-1.amazonaws.com/0000/0000/0035/candidates/0000/0000/0279/m_logo_bla_1-1554927399.png,The legalisation of the personal use of soft drugs is to be welcomed,7
0.0,1352,Motion om åtgärder mot brottslighet,Sverigedemokraterna avvisar sådana förslag. Vi vill istället se kraftiga åtgärder mot narkotika.,https://www.riksdagen.se/sv/dokument-lagar/dokument/motion/krafttag-mot-brottslighet_H602133/html,SE,Sweden,280,Sweden Democrats,SD,http://files2.societly.com.s3-website.eu-central-1.amazonaws.com/0000/0000/0035/candidates/0000/0000/0280/sverigedem-1554896400.png,The legalisation of the personal use of soft drugs is to be welcomed,7
0.0,1352,Partiprogram,"""Alkohol och andra droger orsakar samhället enorma kostnader och drabbade individer stort lidande. Polisens arbete ska därför fokusera på att motverka försäljning och langning av narkotika. Den enskildas missbruk är en sjukdom och vi vill se ett ändrat fokus från straff till vård. Personer som lider av missbruksproblematik ska erbjudas bästa möjliga hjälp och stöd, att komma ur sitt beroende och att få ett värdigt liv genom sådant som sprututbytesprogram och medicinering. Målet är ett narkotikafritt samhälle."" (sida 6)",https://www.mp.se/sites/default/files/miljopartiets_partiprogram_lagupplost_2013.pdf,SE,Sweden,410,Green Party,MP,http://files2.societly.com.s3-website.eu-central-1.amazonaws.com/0000/0000/0035/candidates/0000/0000/0410/milj%C3%B6partiet-1554896485.jpg,The legalisation of the personal use of soft drugs is to be welcomed,7
0.0,1352,Partiets hemsida,"""Vi vill ha ett narkotikafritt samhälle och arbetar för att stoppa alla tendenser till drogliberalisering.""",https://kristdemokraterna.se/politik-a-o/narkotika/,SE,Sweden,411,Christian Democrats,KD,http://files2.societly.com.s3-website.eu-central-1.amazonaws.com/0000/0000/0035/candidates/0000/0000/0411/kristdemokraterna_logo-1554896646.jpg,The legalisation of the personal use of soft drugs is to be welcomed,7
0.0,1352,Partiprogram,"""Fi ska verka för att Sverige, inom ramen för EU-samarbetet, kraftfullt motverkar krav på avregleringar och legaliseringar inom alkohol- och drogpolitiska områden."" (sida 80)",https://feministisktinitiativ.se/wp-content/uploads/2018/10/fi-for-en-feministisk-politik-rev07_2017-pdf.pdf,SE,Sweden,412,Feminist Initiative,FI,http://files2.societly.com.s3-website.eu-central-1.amazonaws.com/0000/0000/0035/candidates/0000/0000/0412/feministisktinitiativ-1554896704.png,The legalisation of the personal use of soft drugs is to be welcomed,7
0.0,1352,Nyhetsartikel (SVT),"""– Vi ser inte någon anledning att se över nuvarande lagstiftning. Vi är emot en legalisering av cannabis, säger Peter Liljeros, pressekreterare på Socialdemokraterna.""",https://www.svt.se/nyheter/inrikes/sa-staller-riksdagspartierna-till-en-legalisering-av-cannabis,SE,Sweden,414,Social Democrats,S,http://files2.societly.com.s3-website.eu-central-1.amazonaws.com/0000/0000/0035/candidates/0000/0000/0414/socialdemokraterna-1554896161.jpg,The legalisation of the personal use of soft drugs is to be welcomed,7
0.0,1352,Partiets hemsida,"""Vänsterpartiet avvisar alla förslag som skulle innebära att illegala droger legaliseras. Det skulle göra att marknaden utvidgas och att fler riskerar ett drogberoende. """,https://www.vansterpartiet.se/politik/droger-missbruk-och-beroende/,SE,Sweden,415,Left,V,http://files2.societly.com.s3-website.eu-central-1.amazonaws.com/0000/0000/0035/candidates/0000/0000/0415/1200px-left_party_(sweden)_logo.svg-1554896298.png,The legalisation of the personal use of soft drugs is to be welcomed,7
0.0,1353,Partiets webb,"Idag kan vi säga nej till livsuppehållande behandling, och vi kan begära att den avbryts. Den som har svåra smärtor eller ångest kan få läkemedel för att sova sig in i döden. Men det är inte tillåtet för sjukvården att hjälpa någon att avsluta sitt liv. Vi tycker att det är en bra regel. Ett beslut att dö går inte att ångra i efterhand.",https://www.liberalerna.se/politik/livets-slut/,SE,Sweden,277,The Liberals,L,http://files2.societly.com.s3-website.eu-central-1.amazonaws.com/0000/0000/0035/candidates/0000/0000/0277/logo-l-large-ny3-1555010057.jpg,Euthanasia should be legalised,8
0.0,1353,Partiets webb,"Alla människor har rätt att bestämma över sitt eget liv, att få bästa möjliga vård och att få dö under värdiga former. Därför har man också rätt att avstå från behandling och vården ska acceptera det beslutet. Däremot tycker vi inte att patienter ska kunna kräva att vården aktivt ska hjälpa dem att dö. Vårdens uppgift är att bota, lindra och trösta. Att aktivt medverka till en annan persons död går emot all läkaretik och vi tycker att det är fel att kräva av vårdpersonal att de ska behöva göra det. Det kan också vara mycket svårt att avgöra vad som är patientens egen vilja och vad som är en önskan om att lätta på anhörigas börda.  Centerpartiet anser att aktiv dödshjälp strider mot sjukvårdens etiska grundprinciper om att stå i livets tjänst, bota, lindra och trösta. Det står även i strid med den etik som samhället baseras på, nämligen att ingen har rätt att ta en annan människas liv. """,https://www.centerpartiet.se/var-politik/politik-a-o/vard-och-omsorg/dodshjalp,SE,Sweden,278,Centre Party,C,http://files2.societly.com.s3-website.eu-central-1.amazonaws.com/0000/0000/0035/candidates/0000/0000/0278/centern-1554927492.png,Euthanasia should be legalised,8
0.0,1353,Artikel i Dagen,Moderaterna verkar inte för en legalisering av dödshjälp i Sverige. Samhället ska värna rätten till liv. Dödshjälp strider mot den principen.,https://www.dagen.se/nyheter/moderaterna-om-aktiv-dodshjalp-1.1191497?paywall=true,SE,Sweden,279,Moderate Party,M,http://files2.societly.com.s3-website.eu-central-1.amazonaws.com/0000/0000/0035/candidates/0000/0000/0279/m_logo_bla_1-1554927399.png,Euthanasia should be legalised,8
0.0,1353,Handlingar Landsdagar 2017,"Frågan var uppe för bedömning på partiets landsdagar 2017. Landsdagarna valde att avslå förslag om att legalisera dödshjälp, bl.a. mot bakgrund av att frågan inte är tillräckligt väl utredd.",https://sd.se/wp-content/uploads/2017/11/ld_politiska_vårdomsorg.pdf,SE,Sweden,280,Sweden Democrats,SD,http://files2.societly.com.s3-website.eu-central-1.amazonaws.com/0000/0000/0035/candidates/0000/0000/0280/sverigedem-1554896400.png,Euthanasia should be legalised,8
50.0,1353,Nyhetsartikel (Aftonbladet 2014),"I Aftonbladets Valkompass inför valet till EU-parlamentet den 25 maj har partiernas toppkandidater fått frågan om aktiv dödshjälp ska tillåtas.  ...  De partierna som är mest splittrade är Feministiskt Initiativ och Miljöpartiet, där 4 av 8, respektive 4 av 10 är positiva.",https://www.aftonbladet.se/nyheter/a/0EWwwo/har-ar-politikerna-som-vill-infora-dodshjalp,SE,Sweden,410,Green Party,MP,http://files2.societly.com.s3-website.eu-central-1.amazonaws.com/0000/0000/0035/candidates/0000/0000/0410/milj%C3%B6partiet-1554896485.jpg,Euthanasia should be legalised,8
0.0,1353,Partiets hemsida,"""Sjukvårdens uppgift är att bota, lindra och trösta. Aktiv dödshjälp (eutanasi) och assisterade självmord är, och skall fortsatt vara förbjudet.""",https://kristdemokraterna.se/politik-a-o/dodshjalp/,SE,Sweden,411,Christian Democrats,KD,http://files2.societly.com.s3-website.eu-central-1.amazonaws.com/0000/0000/0035/candidates/0000/0000/0411/kristdemokraterna_logo-1554896646.jpg,Euthanasia should be legalised,8
50.0,1353,Nyhetsartikel (Aftonbladet 2014),"""I Aftonbladets Valkompass inför valet till EU-parlamentet den 25 maj har partiernas toppkandidater fått frågan om aktiv dödshjälp ska tillåtas.  ...  De partierna som är mest splittrade är Feministiskt Initiativ och Miljöpartiet, där 4 av 8, respektive 4 av 10 är positiva.""",https://www.aftonbladet.se/nyheter/a/0EWwwo/har-ar-politikerna-som-vill-infora-dodshjalp,SE,Sweden,412,Feminist Initiative,FI,http://files2.societly.com.s3-website.eu-central-1.amazonaws.com/0000/0000/0035/candidates/0000/0000/0412/feministisktinitiativ-1554896704.png,Euthanasia should be legalised,8
0.0,1353,Nyhetsartikel (Aftonbladet 2014),"""I Aftonbladets Valkompass inför valet till EU-parlamentet den 25 maj har partiernas toppkandidater fått frågan om aktiv dödshjälp ska tillåtas.  Av de 96 stycken politiker som har svarat är dock bara 30 stycken för.  Störst är motståndet hos Kristdemokraterna och Socialdemokraterna - där ingen av partiernas kandidater har svarat ja.""",https://www.aftonbladet.se/nyheter/a/0EWwwo/har-ar-politikerna-som-vill-infora-dodshjalp,SE,Sweden,414,Social Democrats,S,http://files2.societly.com.s3-website.eu-central-1.amazonaws.com/0000/0000/0035/candidates/0000/0000/0414/socialdemokraterna-1554896161.jpg,Euthanasia should be legalised,8
0.0,1353,Intervju med partiledare,"Jonas Sjöstedt (i videon, 10:22):  ""… och så finns det några få åsikter där jag har lite annan åsikt än Vänsterpartiet ... (10:31) Jag är för dödshjälp. Vänsterpartiet är emot, men jag har långsamt svängt till att tänka om jag själv var dödsjuk då skulle jag själv vilja välja när jag dör.""",https://www.youtube.com/watch?v=v9sEXkmzXtc&t=22s,SE,Sweden,415,Left,V,http://files2.societly.com.s3-website.eu-central-1.amazonaws.com/0000/0000/0035/candidates/0000/0000/0415/1200px-left_party_(sweden)_logo.svg-1554896298.png,Euthanasia should be legalised,8
75.0,1354,Partiets webb,På sikt vill vi som liberalt parti ha ett så lågt skattetryck som möjligt – i kombination med fortsatt stora ambitioner vad gäller kärnan i vår gemensamma välfärd. Det är möjligt om man skalar bort allt som vi tycker att staten inte ska ägna sig åt.,https://www.liberalerna.se/politik/ekonomi/,SE,Sweden,277,The Liberals,L,http://files2.societly.com.s3-website.eu-central-1.amazonaws.com/0000/0000/0035/candidates/0000/0000/0277/logo-l-large-ny3-1555010057.jpg,Government spending should be reduced in order to lower taxes,9
75.0,1354,Partiets webb,"Skattetrycket i Sverige måste sänkas från dagens nivåer, som är bland de absolut högsta i världen. Centerpartiet vill effektivisera och sänka utgifter samtidigt som vi vill genomföra skattesänkningar, inte minst för att anställa i små och växande företag. Centerpartiets ekonomiska politik har konsekvent fokuserat på att effektivisera statens budget och kapa ineffektiva åtgärder och satsningar till förmån för satsningar som stärker tillväxt, jobb och företagande med en stark välfärd.",https://www.centerpartiet.se/var-politik/politik-a-o/ekonomi-och-skatter/gron-skattevaxling,SE,Sweden,278,Centre Party,C,http://files2.societly.com.s3-website.eu-central-1.amazonaws.com/0000/0000/0035/candidates/0000/0000/0278/centern-1554927492.png,Government spending should be reduced in order to lower taxes,9
100.0,1354,Valmanifest 2018,"Moderaternas förslag: Sänk skatten för alla som jobbar. Principen om hälften kvar är viktig. Därför vill Moderaterna sänka marginalskatten genom att höja brytpunkten för statlig skatt. Sänk skatten för alla Sveriges pensionärer. Pension och lön bör beskattas lika.  Sänk skatten för äldre som vill fortsätta arbeta, genom förstärkt jobbskatteavdrag. Initiera en skattereform för bättre villkor för företagens investeringar och sänkta skatter på arbete.  Sänk skatten på arbete och inför bidragstak för att arbete alltid ska löna sig bättre än bidrag.  Sänk skatten på diesel i jord- och skogsbruket.",https://moderaterna.se/sites/default/files/page_attachments/2018-08/Valmanifest%20HÖG%20180820.pdf,SE,Sweden,279,Moderate Party,M,http://files2.societly.com.s3-website.eu-central-1.amazonaws.com/0000/0000/0035/candidates/0000/0000/0279/m_logo_bla_1-1554927399.png,Government spending should be reduced in order to lower taxes,9
75.0,1354,SD budgetmotion 2019,Sverigedemokraterna har i budgetmotion för 2019 föreslagit skattesänkningar om ca 30 mdr per år i förhållande till Regeringen. Skattesänkningar riktar sig primärt på låga inkomster från tjänst eller pension. De finansieras bl.a. genom omprioriteringar från bistånd och migrationsrelaterade utgiftsposter. På så vis kan skatterna sänkas samtidigt som välfärden byggs ut.,https://sd.se/wp-content/uploads/2018/11/Budgetmotion-2019.pdf,SE,Sweden,280,Sweden Democrats,SD,http://files2.societly.com.s3-website.eu-central-1.amazonaws.com/0000/0000/0035/candidates/0000/0000/0280/sverigedem-1554896400.png,Government spending should be reduced in order to lower taxes,9
0.0,1354,Partiprogram,"""Vi kommer sannolikt också behöva nya skattebaser och är beredda att genom skatt öka den offentliga konsumtionen på bekostnad av den privata när det är nödvändigt för att trygga välfärden och samhällstryggheten"" (sida 20)",https://www.mp.se/sites/default/files/miljopartiets_partiprogram_lagupplost_2013.pdf,SE,Sweden,410,Green Party,MP,http://files2.societly.com.s3-website.eu-central-1.amazonaws.com/0000/0000/0035/candidates/0000/0000/0410/milj%C3%B6partiet-1554896485.jpg,Government spending should be reduced in order to lower taxes,9
100.0,1354,Partiets hemsida,"""Skatterna ska gå till god vård, bra skola och en äldreomsorg våra äldre kan lita på. Fungerar dessa saker väl bör man fråga sig om skatten inte bör sänkas så att fler har jobb och fler kan få pengarna att räcka till i vardagen – en välfärd nog så viktig som den offentliga."" (förord)",https://kristdemokraterna.se/wp-content/uploads/2018/01/Kommunalt-skattesl%C3%B6seri.pdf,SE,Sweden,411,Christian Democrats,KD,http://files2.societly.com.s3-website.eu-central-1.amazonaws.com/0000/0000/0035/candidates/0000/0000/0411/kristdemokraterna_logo-1554896646.jpg,Government spending should be reduced in order to lower taxes,9
0.0,1354,Partiprogram,"""Borttagandet av förmögenhetsskatterna har, tillsammans med införandet av jobbskatteavdragen, både bidragit till ökade ekonomiska klyftor och till att urholka skattebasen. Det har kraftigt försämrat omfördelningseffekten i det svenska skattesystemet där skattebasen utgör grunden för en stark offentlig ekonomi som möjliggör reformer för att uppnå politiska mål och visioner. För att stärka skattekraften anser Feministiskt initiativ att det är nödvändigt att utforma en ny, modern skatt på förmögenhet, gåvor och arv"" (sida 13)",https://feministisktinitiativ.se/wp-content/uploads/2018/10/fi-for-en-feministisk-politik-rev07_2017-pdf.pdf,SE,Sweden,412,Feminist Initiative,FI,http://files2.societly.com.s3-website.eu-central-1.amazonaws.com/0000/0000/0035/candidates/0000/0000/0412/feministisktinitiativ-1554896704.png,Government spending should be reduced in order to lower taxes,9
0.0,1354,Partiets hemsida,"""Socialdemokraterna vill använda den ekonomiska styrkan till investeringar i jobb, skola, vård och omsorg. Ett starkt samhälle med en trygg välfärd går före stora skattesänkningar.""",https://www.socialdemokraterna.se/var-politik/a-till-o/ekonomi/,SE,Sweden,414,Social Democrats,S,http://files2.societly.com.s3-website.eu-central-1.amazonaws.com/0000/0000/0035/candidates/0000/0000/0414/socialdemokraterna-1554896161.jpg,Government spending should be reduced in order to lower taxes,9
0.0,1354,Partiets hemsida,"""Vänsterpartiet vill bygga en stark välfärd som förmår att ge alla människor en bra sjukvård, skola och en trygg ålderdom. Vi bidrar alla till att göra det möjligt genom att betala skatt … Vi vill ha högre skatteintäkter än idag, så att vi kan satsa på att skapa fler jobb, på kvalitetshöjningar i välfärden och på investeringar i bostäder och infrastruktur som gynnar både människor och klimat.""",https://www.vansterpartiet.se/politik/skatter/,SE,Sweden,415,Left,V,http://files2.societly.com.s3-website.eu-central-1.amazonaws.com/0000/0000/0035/candidates/0000/0000/0415/1200px-left_party_(sweden)_logo.svg-1554896298.png,Government spending should be reduced in order to lower taxes,9
75.0,1355,Liberalernas program inför valet till Europaparlamentet 2019,"Liberalerna vill införa en europeisk koldioxidskatt, vilket skulle vara en av de mest effektiva åtgärderna för att ställa om och minska utsläppen, från bland annat transportsektorn, samt bana väg för innovation och grön teknik. Genom en sådan skatt kan EU även med trovärdighet trycka på för att få fler länder i världen att följa efter. Skatten ska på sikt tas in på EU-nivå och vara en intäkt till EU-budgeten. Som ett första steg bör en harmoniserad lägstanivå för koldioxidbeskattning i EU:s medlemsländer införas.",https://www.liberalerna.se/wp-content/uploads/1902-eu-program-1.pdf ,SE,Sweden,277,The Liberals,L,http://files2.societly.com.s3-website.eu-central-1.amazonaws.com/0000/0000/0035/candidates/0000/0000/0277/logo-l-large-ny3-1555010057.jpg,The EU should acquire its own tax raising powers,10
0.0,1355,Partiets webb,"""EU får inte fokusera på fel saker. Vi tycker exempelvis inte att EU ska lägga sig i de frågor som enskilda människor och beslutsfattare på lokal, regional och nationell nivå bättre kan bestämma om. Hit hör frågor som ländernas skatter, utbildning, välfärd, sociala trygghetssystem, kultur, rovdjurspolitik och naturresurser.  För oss är det viktigt att beslut fattas så nära människor som möjligt. Därför är det en viktig princip för oss att beskattningsrätten förblir en nationell fråga.""",https://www.centerpartiet.se/var-politik/politik-a-o/europa,SE,Sweden,278,Centre Party,C,http://files2.societly.com.s3-website.eu-central-1.amazonaws.com/0000/0000/0035/candidates/0000/0000/0278/centern-1554927492.png,The EU should acquire its own tax raising powers,10
0.0,1355,Intervju med Tomas Tobé,"Dock ogillar han förslaget om att införa en europeisk koldioxidskatt. Istället vill han utveckla och bygga ut systemet med handel av utsläppsrätter. ”– Jag tycker det är fel att ge EU beskattningsrätt. Jag tycker det är viktigare att skapa en hållbar klimatpolitik så att människor och andra länder ser att det går att förena ökad tillväxt med klimatnytta.""",https://www.europaportalen.se/2019/03/moderaternas-toppnamn-europa-far-inte-splittras,SE,Sweden,279,Moderate Party,M,http://files2.societly.com.s3-website.eu-central-1.amazonaws.com/0000/0000/0035/candidates/0000/0000/0279/m_logo_bla_1-1554927399.png,The EU should acquire its own tax raising powers,10
0.0,1355,SD valplattform EP2019,Sverigedemokraterna motsätter sig alla förslag om att ge EU egen beskattningsrätt.,https://sd.se/wp-content/uploads/2019/03/EU-Valplattform-2019.pdf,SE,Sweden,280,Sweden Democrats,SD,http://files2.societly.com.s3-website.eu-central-1.amazonaws.com/0000/0000/0035/candidates/0000/0000/0280/sverigedem-1554896400.png,The EU should acquire its own tax raising powers,10
50.0,1355,EU-valmanifest 2014,"""För ett grönare EU vill Miljöpartiet: ... 6) att EU ska ta beslut om miniminivåer för medlemsländernas miljöskatter, men skatteintäkterna ska tillfalla medlemsländerna. EU ska inte ha egen överstatlig beskattningsrätt.""",https://www.mp.se/eu/valmanifest-del-1,SE,Sweden,410,Green Party,MP,http://files2.societly.com.s3-website.eu-central-1.amazonaws.com/0000/0000/0035/candidates/0000/0000/0410/milj%C3%B6partiet-1554896485.jpg,The EU should acquire its own tax raising powers,10
0.0,1355,EU-valmanifest 2019,"""Det finns många skäl att motsätta sig beskattning på EU-nivå. Att EU-kommissionen inte längre skulle behöva ta omvägen via medlemsländerna är en aspekt som förmodligen skulle leda till mer generös syn på utgifter. Att beskattning av subsidiaritetsskäl bör vara exklusiv nationell kompetens är en annan."" (sida 13)",https://kristdemokraterna.se/wp-content/uploads/2019/01/europapolitiskt-program-beslutad-av-PF-slutversion.pdf,SE,Sweden,411,Christian Democrats,KD,http://files2.societly.com.s3-website.eu-central-1.amazonaws.com/0000/0000/0035/candidates/0000/0000/0411/kristdemokraterna_logo-1554896646.jpg,The EU should acquire its own tax raising powers,10
25.0,1355,Partiprogram,"""EU ska enbart besluta i frågor som är av gemensamt intresse och där det finns ett tydligt mervärde i att beslutet fattas på EU-nivå. Det kan handla om att påverka enskilda medlemsländer att höja standarden där krafterna på den nationella nivån inte räcker till som i frågor om diskriminering och i vissa miljöfrågor. Feministiskt initiativ anser att EU:s roll ska vara att sätta miniminivåer i frågor som till exempel rör diskriminering och mänskliga rättigheter men inte begränsa enskilda medlemsländer som vill genomföra ett starkare skydd inom dessa områden. I frågor av gemensamt intresse där EU inte ska fatta beslut kan EU ändå verka som en positiv kraft för förändring."" (sida 200)",https://feministisktinitiativ.se/wp-content/uploads/2018/10/fi-for-en-feministisk-politik-rev07_2017-pdf.pdf,SE,Sweden,412,Feminist Initiative,FI,http://files2.societly.com.s3-website.eu-central-1.amazonaws.com/0000/0000/0035/candidates/0000/0000/0412/feministisktinitiativ-1554896704.png,The EU should acquire its own tax raising powers,10
0.0,1355,Nyhetsartikel (Europaportalen),"""– Det är ingen hemlighet att många socialdemokratiska partier i Europa vill att EU ska ha en större budget och att man ska ha möjlighet att ta in skatt på europeisk nivå. Det är saker vi reserverat oss mot, säger Johan Hassel och fortsätter:  – Vi har också betonat att man ska respektera de arbetsmarknadsmodeller som finns och att det är nationalstaterna som ska stå för implementeringen av ett socialt Europa.""",https://www.europaportalen.se/2019/03/s-pa-kollisionskurs-med-s-i-europa,SE,Sweden,414,Social Democrats,S,http://files2.societly.com.s3-website.eu-central-1.amazonaws.com/0000/0000/0035/candidates/0000/0000/0414/socialdemokraterna-1554896161.jpg,The EU should acquire its own tax raising powers,10
25.0,1355,Partiprogram,""" I det dagliga arbetet motsätter sig Vänsterpartiet generellt förslag som ökar EU:s makt och försöker istället föra tillbaka makt till medlemsländerna."" (sida 24-25)",https://www.vansterpartiet.se/app/uploads/2017/06/Partiprogram_V-1jun2017.pdf,SE,Sweden,415,Left,V,http://files2.societly.com.s3-website.eu-central-1.amazonaws.com/0000/0000/0035/candidates/0000/0000/0415/1200px-left_party_(sweden)_logo.svg-1554896298.png,The EU should acquire its own tax raising powers,10
25.0,1356,Partiets webb,"""När bolagsskatten går ner i vår omvärld kan den långsiktigt inte avvika i Sverige. För att göra det mer attraktivt att bedriva verksamhet i Sverige behöver vi sänka bolagsskatten ytterligare.  Liberalerna vill uppmuntra fler att bygga upp en egen buffert, och föreslår att alla svenskar ska kunna spara upp till 100 000 kronor skattefritt. Vi vill även återställa skatten på övriga besparingar i ISK-konton som regeringen höjde i höstens budget.  Liberalerna vill se väl fungerande finansmarknader som tillgodoser hushållens och företagens behov av finansiella tjänster samtidigt som det finns ett gott skydd för konsumenter. Vi har därför bland annat tagit ställning för nedtrappade ränteavdrag, för skattefritt sparande på investeringssparkonto, och mot bankskatt.""",https://www.liberalerna.se/politik/bolagsskatt-och-kapitalskatt,SE,Sweden,277,The Liberals,L,http://files2.societly.com.s3-website.eu-central-1.amazonaws.com/0000/0000/0035/candidates/0000/0000/0277/logo-l-large-ny3-1555010057.jpg,Bank and stock market gains should be taxed more heavily,11
0.0,1356,Artikel i Aftonbladet,Snarare än att diskutera en hårdare beskattning bör fokus ligga på mer likformig och enhetlig beskattning. Ett skattesystem ska vara enkelt och transparent. Då kan inte skatter höjas för enskilda sektorer eller vissa typer av kapitalinkomster. Vi kan exempelvis konstatera att det så kallade 3:12 regelverket redan idag är oerhört komplext och behöver förenklas.,https://www.aftonbladet.se/debatt/a/Ov1d1/regeringens-forslag-slar-ut-smaspararna ,SE,Sweden,278,Centre Party,C,http://files2.societly.com.s3-website.eu-central-1.amazonaws.com/0000/0000/0035/candidates/0000/0000/0278/centern-1554927492.png,Bank and stock market gains should be taxed more heavily,11
,1356,,,,SE,Sweden,279,Moderate Party,M,http://files2.societly.com.s3-website.eu-central-1.amazonaws.com/0000/0000/0035/candidates/0000/0000/0279/m_logo_bla_1-1554927399.png,Bank and stock market gains should be taxed more heavily,11
